,,Título,Id,Precio,IdSeller,Nickname,Stock,Cantidad Ventas,Exposicion,MercadoPago ,T. Oficial,Condición,Cuotas,Envío Gratis,Días publicados
58,dolphin e10 robot limpia pileta piscina- consultar stock!!,Robot Dolphin Piscina E10 Limpia Barrefondo Pileta Automatic,MLA604976779,19855,716559,DECOHOGAR,999,285,Clásica,Si, ,Nuevo,6,Si,533
54,irobot roomba 650 aspiradora robot- consultar stock!!!,Irobot Roomba 650 Robot Inteligente Aspiradora Limpia Piso I,MLA614078545,12499,39144101,BIDCOM,973,250,Clásica,Si, ,Nuevo,6,Si,507
55,irobot roomba 860 aspiradora robot - consultar stock!!!,Irobot Roomba 860 Robot Inteligente Aspiradora Limpia Piso,MLA614078544,15999,39144101,BIDCOM,800,206,Clásica,Si, ,Nuevo,6,Si,507
58,dolphin s100 robot limpia pileta piscina -Consultar stock!,Limpia Piscinas Dolphin S100   By Maytronics,MLA607977503,23355,72752255,ASSISTGAS S.R.L.,11,126,Clásica,Si, ,Nuevo,6,Si,538
54,Irobot Roomba 621 Aspiradora Robot - consultar stock!!,Irobot Roomba 621 Inteligente Aspiradora Limpia Piso,MLA603964847,8499,39144101,BIDCOM,413,99,Clásica,Si, ,Nuevo,6,Si,561
0,,Robot Dolphin E10 Nuevo Modelo Limpia Fondo Pileta Piscina,MLA611343376,18362,7625198,SANITARIOS-ARIETA,984,77,Clásica,Si, ,Nuevo,6,Si,520
59,dolphin s200 Robot limpia pileta piscina - Consultar stock!,Robot Dolphin Barre Fondo S200 Limpia Piscina Pileta Envios,MLA647267482,29930,179035500,HIDROAL,1,77,Clásica,Si, ,Nuevo,6,Si,239
53,irobot roomba 980 Aspiradora Robot - Consultar Stock!,Irobot Roomba 980 Aspiradora Inteligente Robot Original Gtia,MLA608645314,25999,39144101,BIDCOM,971,75,Clásica,Si, ,Nuevo,6,Si,534
0,,Limpiapiscina Automat Acuatic Explorer Up Barrefondo_fabrica,MLA605429205,5900,104148929,ACUATIC FABRICA,9,73,Clásica,Si, ,Nuevo,6,No,552
0,,Robot Dolphin Barre Fondo S100 Limpia Piscina Pileta Envios,MLA647268683,23355,179035500,HIDROAL,4,61,Clásica,Si, ,Nuevo,6,Si,239
0,,Irobot - Roomba 650 - Aspiradora Robot,MLA603859988,"12499,99",161703332,AFTECH.CORP.ARG,6,45,Clásica,Si,iRobot,Nuevo,6,No,533
26,atma 8991 aspiradora robot,Aspiradora Atma 8991e Robot,MLA637694812,5099,212439741,HM HOGAR,1,36,Clásica,Si, ,Nuevo,6,No,316
0,,Robot Barrefondo Limpia Pileta Piscina Dolphin E10 Prestigio,MLA604164386,17789,165962418,PRESTIGIO STORE,28,28,Clásica,Si,Prestigio,Nuevo,6,Si,533
0,,Aspiradora Inteligente Roomba Irobot 621 Inalambrica Piso,MLA623163772,8499,39144101,BIDCOM,472,28,Clásica,Si, ,Nuevo,6,Si,436
0,,"Zancos De Aluminio Rojos, Durlock, Robot Led, Envío Gratis",MLA642451824,5099,182542742,PROVETEC SOLUCIONES-IND,11,26,Clásica,Si, ,Nuevo,6,Si,278
11,dolphin s50,Robot Dolphin S50 Limpia Piscina Pileta Barre Fondo,MLA632530934,16941,84051956,CLIMADESIGN,99973,26,Clásica,Si, ,Nuevo,6,Si,356
0,,Robot Limpia Piletas Dolphin S100 Envio Gratis Todo El Pais,MLA633543883,24300,98215394,FERRETERIAPACHECO,74,26,Clásica,Si, ,Nuevo,6,Si,349
0,,Robot Dolphin S100 -limpia Piletas Fondo Y Paredes! Nuevo,MLA632259992,23350,179355361,SANCHEZBUSTOS,80,20,Clásica,Si, ,Nuevo,6,Si,358
0,,Robot Dolphin Para Piscina S200 Serie S Limpia Fondo Pileta,MLA636223557,29930,7625198,SANITARIOS-ARIETA,999,19,Clásica,Si, ,Nuevo,6,Si,327
0,,Robot Limpia Fondo De Pileta Piscina Dolphin E20 - Rex,MLA608896273,27862,132453365,PINTURERIASREX,4,19,Clásica,Si,Pinturerias Rex,Nuevo,6,Si,533
0,,Robot Dolphin Supreme M4 Pro Limpiafondo Pileta En La Plata,MLA616769688,34605,143487279,HIDROPLAT,1,18,Clásica,Si, ,Nuevo,6,Si,488
0,,Robot Dolphin M4 Pro Limpia Fondo Piscinas Ult Modelo Gtía,MLA630347139,34605,97104203,SERVITEK_AR,83,17,Clásica,Si, ,Nuevo,6,Si,375
45,dophin supreme m3 robot limpia pileta piscina,Robot Filtro Limpiafondo Dolphin Supreme M3 Trepa Paredes,MLA603573441,"22399,99",34120743,TODOFERRETERIA,97,16,Clásica,Si, ,Nuevo,6,No,562
0,,Robot Dolphin Barre Fondo S50 Limpia Piscina Pileta Envios,MLA647268696,18910,179035500,HIDROAL,43,16,Clásica,Si, ,Nuevo,6,Si,239
0,,Robot Dolphin S50 Nuevo Modelo Limpia Barre Fondo Y Zócalos,MLA630346297,16942,97104203,SERVITEK_AR,121,16,Clásica,Si, ,Nuevo,6,Si,375
,,Robot Limpia Piscina Aquabot I2 Barrefondo Automatico 15mts,MLA649142252,"13499,99",75482619,ANSILA,4,15,Clásica,Si, ,Nuevo,6,Si,222
,,Limpia Fondos Automatico Para Piscinas,MLA633051538,5000,33916053,PISCINASLULAKE,11,15,Clásica,Si, ,Nuevo,6,No,352
,,Robot Dolphin S200 Limpia Piletas Inteligente Envio Gratis,MLA632257650,29920,179355361,SANCHEZBUSTOS,85,15,Clásica,Si, ,Nuevo,6,Si,358
,,Irobot Roomba 650 Robot Inteligente Aspiradora Limpia Piso,MLA641054552,12499,39144101,BIDCOM,1012,14,Clásica,Si, ,Nuevo,6,Si,289
,,Robot Limpiapiscinas Dolphin S100 Nuevo Limpia Piso Y Pared!,MLA633247097,23355,176668703,MULTIMAKS,10,14,Clásica,Si, ,Nuevo,6,Si,351
,,Aspiradora Robot Smart-tek Ava Mini  Control Remoto,MLA631713081,"7919,01",65199373,SOUND-GROUP,99985,14,Clásica,Si, ,Nuevo,6,No,363
,,Robot Dolphin S300i Limpia Fondo De Piscina En La Plata,MLA617913823,33170,143487279,HIDROPLAT,1,14,Clásica,Si, ,Nuevo,6,Si,478
,,Robot Dolphin Limpia Piscinas Barrefondo Pileta E10 - Rex,MLA608494092,19652,132453365,PINTURERIASREX,5,14,Clásica,Si,Pinturerias Rex,Nuevo,6,Si,533
,,Robot Inteligente Irobot Roomba 860 Kit De Regalo Aspiradora,MLA641294189,15999,39144101,BIDCOM,1013,13,Clásica,Si, ,Nuevo,6,Si,287
,,Robot Dolphin S300 I Limpia Fondo Pileta Piscina Bluetooth,MLA615376507,32636,84051956,CLIMADESIGN,99994,13,Clásica,Si, ,Nuevo,6,Si,499
,,Limpia Piscinas Dolphin S200     By Maytronics,MLA616270357,29930,72752255,ASSISTGAS S.R.L.,10,12,Clásica,Si, ,Nuevo,6,Si,491
,,Robot Dolphin Para Piscina S100 Serie S Limpia Fondo Pileta,MLA636223528,23355,7625198,SANITARIOS-ARIETA,999,12,Clásica,Si, ,Nuevo,6,Si,327
,,"Zancos Drywall Stilts Rojo (de Aluminio, Durlock, Robot Led)",MLA640561995,5040,205773687,CABALLITODISTRIBUIDORA,4,12,Clásica,Si, ,Nuevo,6,Si,293
,,Robot Aspiradora Inteligente Neato D85 Limpia Piso,MLA647409167,16999,7625198,SANITARIOS-ARIETA,988,11,Clásica,Si, ,Nuevo,6,Si,238
,,Robot Limpia Pileta Dolphin S100 Barrefondo + Regalos,MLA635223573,23355,190455921,SORBELLINISORBELLINI,3,11,Clásica,Si, ,Nuevo,6,Si,335
,,Limpia Piscinas Dolphin S50 Limpia Fondos De Piscina Robot,MLA632271098,18910,72752255,ASSISTGAS S.R.L.,7,10,Clásica,Si, ,Nuevo,6,Si,358
,,Robot Aquabot Rapid 4wd Limpiafondo Automatico,MLA604811485,22499,170800723,AQUACHLOR,1,10,Clásica,Si, ,Nuevo,6,Si,533
,,Kit P/ Construir Tjbot Ibm Watson Maker Robot Ai Cognitivo,MLA624801251,6900,135668396,CANDY-HO,1,9,Clásica,Si, ,Nuevo,6,No,422
,,Robot Dolphin S200 Limpia Piscina Pileta Barre Fondo Paredes,MLA632535383,27198,84051956,CLIMADESIGN,9,9,Clásica,Si, ,Nuevo,6,Si,356
,,Robot Limpia Piletas Dolphin S200 Envio Gratis Todo El Pais,MLA633548821,31140,98215394,FERRETERIAPACHECO,91,9,Clásica,Si, ,Nuevo,6,Si,349
,,Robot Dolphin S50 Limpiafondo Automatico Piletas Piscinas,MLA618702729,19674,178546395,HIDROFILML,2,9,Clásica,Si, ,Nuevo,6,Si,472
,,Roomba Irobot 980 Original Distribuidor Robot Aspiradora,MLA612122176,25999,39144101,BIDCOM,991,8,Clásica,Si, ,Nuevo,6,Si,517
,,Robot Dolphin Para Piscina S50 Serie S Limpia Fondo Pileta,MLA636223519,18910,7625198,SANITARIOS-ARIETA,999,8,Clásica,Si, ,Nuevo,6,Si,327
,,Robot Dolphin S100 - Barrefondo Automatico -  Envio Gratis,MLA634456701,23330,48140082,BLADEARGENTINA,999,8,Clásica,Si, ,Nuevo,6,Si,341
,,Día Del Niño: Robot Dash Aprende A Programar Jugando.,MLA629670782,6100,220767078,DASHYDOT,20,7,Clásica,Si, ,Nuevo,6,Si,381
,,Robot Limpia Barre Fondo Pileta Dolphin Diagnostic Prestigio,MLA607554978,27900,165962418,PRESTIGIO STORE,8,7,Clásica,Si,Prestigio,Nuevo,6,Si,533
,,Aspiradora Robot Inteligente Neato Botvac D75 Laser Programa,MLA603607551,16380,75482619,ANSILA,2,7,Clásica,Si, ,Nuevo,6,Si,533
,,Aspiradora Pelos Roomba Irobot 621  Alfombra Sensores,MLA623164421,8499,39144101,BIDCOM,493,7,Clásica,Si, ,Nuevo,6,Si,436
,,Robot Aquabot Rapid 4wd Limpiafondo Piscina Trepa Pared,MLA643374285,22390,83417473,PINTURERIASMM,13,7,Premium,Si,Pinturerias MM,Nuevo,6,Si,271
,,Dia Del Niño: Robot Dash + Dot + Accesorios Wonder Pack!,MLA643743445,8900,220767078,DASHYDOT,20,6,Clásica,Si, ,Nuevo,6,No,268
,,Robot Dolphin S100 Limpia Fondo Para Piscinas La Plata,MLA634815787,23355,143487279,HIDROPLAT,1,6,Clásica,Si, ,Nuevo,6,Si,338
,,"Traje Completo Robot De Leds - Circo ,todo Para Tu Evento",MLA604422926,14000,186270170,ANDYFREAKYBOY,1,6,Clásica,Si, ,Nuevo,6,No,558
,,Robot Aquabot Rapid 4wd Limpiafondo Piscina Trepa Pared,MLA611561685,"24068,95",176668703,MULTIMAKS,3,6,Clásica,Si, ,Nuevo,6,Si,520
,,Robot Limpia Piscinas Dolphin S100 Nuevo Limpia Piso Y Pared,MLA636998459,22680,9937333,FERRETERIACENTRALSRL,1,6,Clásica,Si, ,Nuevo,6,Si,321
,,Robot Dolphin S50 -limpia Piletas Fondo Y Angulos! Nuevo,MLA632260597,18910,179355361,SANCHEZBUSTOS,94,6,Clásica,Si, ,Nuevo,6,Si,358
,,Robot Inteligente Cozmo Espectacular A Pedido!!!,MLA645986047,9500,90952429,PS3ARGENTINA,1,5,Clásica,Si, ,Nuevo,6,No,249
,,Robot Perro Inteligente Chip Cuartito Azul Espectacular!,MLA669251225,8690,176500829,CUARTITO AZUL,2,5,Clásica,Si, ,Nuevo,6,No,73
,,Robot Aquabot I2 Para Limpieza Piscina Piletas,MLA647287218,12999,170800723,AQUACHLOR,2,5,Clásica,Si, ,Nuevo,6,Si,239
,,Mixer Micromix Robot Coupe Profesional Frances,MLA665930611,7260,164290689,BAZARGASTROPRECIO,15,5,Clásica,Si, ,Nuevo,6,No,97
,,Robot Dolphin S200 - Barrefondo - Robot De Piletas,MLA633290013,31140,226199021,ROBOTDEPILETAS,15,5,Clásica,Si, ,Nuevo,6,Si,350
,,Limpiador De Piscinas Irobot Mirra 530 Fondo Y Pared Robot,MLA602880346,"34999,99",75482619,ANSILA,4,5,Clásica,Si, ,Nuevo,6,Si,533
,,Robot Filtro Limpiafondo Dolphin Diagnostic Pileta Pintada,MLA609848612,"27899,99",34120743,TODOFERRETERIA,9,5,Clásica,Si, ,Nuevo,6,No,528
,,Robot Filtro Limpiafondo Dolphin Diagnostic Pileta Revestida,MLA610748086,"29524,99",34120743,TODOFERRETERIA,9,5,Clásica,Si, ,Nuevo,6,No,524
,,Robot Led Traje Show Oferta!,MLA615321789,18000,147505108,ROBOTSHOW,2,5,Clásica,Si, ,Nuevo,6,No,499
,,Robot Barrefondo Limpia Pileta Piscina Dolphin E20 Prestigio,MLA635086871,27862,165962418,PRESTIGIO STORE,26,4,Clásica,Si,Prestigio,Nuevo,6,Si,335
,,Roomba Irobot 860 Original Distribuidor Oficial Robot Aspira,MLA612120820,15999,39144101,BIDCOM,348,4,Clásica,Si, ,Nuevo,6,Si,517
,,Robot Limpia Piletas Dolphin S100 Envio Gratis Todo El Pais,MLA641439931,20925,97104203,SERVITEK_AR,899,4,Clásica,Si, ,Nuevo,6,Si,286
,,Kit Motor Porton Automático Porton Pivotante Peccinin Robot,MLA614874970,16890,86902629,FERRECENT,298,4,Clásica,Si, ,Nuevo,6,No,502
,,Auto A Bateria Bmw 12v. Bfun Auto Robot Transformer - Luces*,MLA643853125,6999,16053292,IMAGICFOTOGRAFÍA,9996,4,Clásica,Si, ,Nuevo,6,No,267
,,"Robot Led Traje Completo Con Zancos, Marco Y Pechera Led",MLA640166087,19500,57137813,GC-EVENTOS,7,4,Clásica,Si, ,Nuevo,6,No,295
,,Limpiafondo Automatico Acuatic Explorer Up Directo Fabrica,MLA638597041,5900,89945530,NATATORIOSJG,6,4,Clásica,Si, ,Nuevo,6,No,308
,,Robot De Leds -con Zancos-completo,MLA617973517,17000,186270170,ANDYFREAKYBOY,1,4,Clásica,Si, ,Nuevo,6,No,478
,,Robot Dolphin S50 Limpia Fondo Piscina Pileta Barrefondo,MLA620751967,18362,200861406,FERRETERIA_FREIRE,1,4,Clásica,Si, ,Nuevo,6,Si,456
,,Robot Dolphin S100 Trepa Paredes,MLA641123841,23300,67585694,CLOROOLIVOS,10,4,Clásica,Si, ,Nuevo,6,Si,289
,,Mixer Triturador Profesional De Mano Robot Coupe Emulsion,MLA618885194,7699,52763426,ZACKSBAZAR,1897,4,Clásica,Si, ,Nuevo,6,No,470
,,Robot Dolphin S50 Nuevo Modelo Limpia Barre Fondo Y Zócalos,MLA636544931,18362,9937333,FERRETERIACENTRALSRL,1,3,Clásica,Si, ,Nuevo,6,Si,324
,,Robot Limpia Piletas Aquabot I2,MLA648282387,12900,64855119,NORTE.SERV,7,3,Clásica,Si, ,Nuevo,6,Si,230
,,Aspiradora Robot Inteligente Neato Botvac D85 Inalámbrica,MLA648363492,18165,84051956,CLIMADESIGN,47,3,Clásica,Si, ,Nuevo,6,Si,230
,,Robot Aspiradora Para Pisos - Neato D75 - Con Garantía,MLA653080258,16380,226199021,ROBOTDEPILETAS,2,3,Clásica,Si, ,Nuevo,6,Si,191
,,Aspiradora Robot Inteligente Smart-tek Ava Unica Modelo 2017,MLA668396013,"6999,99",90583461,MEIMPORTO,496,3,Clásica,Si, ,Nuevo,6,No,79
,,Robot Dolphin S50 Limpia Piscina Barrefondo Nueva Envió Caba,MLA636191202,18910,204229801,SAL PARK,1,3,Clásica,Si, ,Nuevo,6,No,327
,,I Pong Pro - Robot Lanza Pelotas - Ping Pong - Tenis De Mesa,MLA652477350,8995,32660849,ANCAR JUEGOS,1,3,Clásica,Si, ,Nuevo,6,Si,196
,,Aspiradora Robot Smart Tek Ava Mini Inalámbrica,MLA626705581,5299,205221838,IDEAHOGAR SA,3,3,Clásica,Si, ,Nuevo,6,No,406
,,"Laboratorio Robotica, Robot Araña, Brazo 5dof, Rover 4 Rueda",MLA662075456,5000,24166266,SISTEMSOFTS,2,3,Clásica,Si, ,Nuevo,6,No,125
,,Robot Aspirador Neato Bv Botvac Connected,MLA677886524,22099,161990496,DTODOAGUA,1,3,Clásica,Si, ,Nuevo,6,Si,8
,,Robot Aspirador Inteligente Apto Para Mascotas Neato D85,MLA677885852,17299,161990496,DTODOAGUA,1,3,Clásica,Si, ,Nuevo,6,Si,8
,,Robot Aspirador Inteligente Neato D75,MLA677885637,14999,161990496,DTODOAGUA,1,3,Clásica,Si, ,Nuevo,6,Si,8
,,Aspiradora Inteligente Irobot Roomba 650 Original Oficial,MLA612119976,12499,39144101,BIDCOM,315,3,Clásica,Si, ,Nuevo,6,Si,517
,,Robot Limpiafondos Dolphin E10 Oferta Ultima Unidad,MLA615276343,"16519,34",176668703,MULTIMAKS,1,3,Clásica,Si, ,Nuevo,6,Si,499
,,Kit Motor Pivotante Batiente Robot Porton 5mts  Seg 1hp,MLA618941642,17999,77592540,COLBEN,3,3,Clásica,Si, ,Nuevo,6,No,470
,,Robot Limpia Piscinas Dolphin S50 Envio Gratis Todo El Pais,MLA633541372,19675,98215394,FERRETERIAPACHECO,97,3,Clásica,Si, ,Nuevo,6,Si,349
,,"Aspiradora Robot Conga, Aspira Y Limpia -mejor Que Roomba!-",MLA678531527,13990,43160377,MAC_TA,1,3,Gratuita,Si, ,Nuevo,6,Si,3
,,Robot De Cocina Thermomix Tm5 Con Cook Key Y Garantía,MLA677734628,30000,265093826,FELISA US,1,3,Gratuita,Si, ,Nuevo,6,No,9
,,"Traje Completo Robot De Leds - Circo ,todo Para Tu Evento",MLA618892994,15000,186270170,ANDYFREAKYBOY,2,3,Clásica,Si, ,Nuevo,6,No,470
,,"Robot Humanoide, Bipedo, 18 Servos, Electrónica Arduino",MLA654226832,5960,24166266,SISTEMSOFTS,3,2,Clásica,Si, ,Nuevo,6,No,183
,,Robot De Programación Wonder Dash Y Dot Accesorios Fact. A/b,MLA616229594,"9999,9",74016573,SISTECO-WEB,29,2,Clásica,Si, ,Nuevo,6,No,492
,,Robot Aspiradora Automática Neato Botvac D75,MLA668753151,13999,39144101,BIDCOM,1,2,Clásica,Si, ,Nuevo,6,No,76
,,Robot Dolphin Supreme M3 Combinado,MLA671860269,17600,236430258,CULZONIPISCINAS,3,2,Clásica,Si, ,Nuevo,6,Si,54
,,Aspiradora Inteligente Robot Smart Ilife V7s Pro A Pedido!!!,MLA670347483,"13999,99",90952429,PS3ARGENTINA,1,2,Clásica,Si, ,Nuevo,6,No,65
,,Aspirador Inteligente Irobot Roomba 621 Oficial Garantia,MLA612271948,8499,39144101,BIDCOM,481,2,Clásica,Si, ,Nuevo,6,Si,516
,,Zancos De Aluminio Durlock Knauf Robot Led,MLA641513190,5040,157910377,DURFACIL,9,2,Premium,Si, ,Nuevo,6,No,286
,,"Traje De Robot Led Con Zancos, Chispas Frias, Marco Led",MLA654661541,14000,57137813,GC-EVENTOS,3,2,Clásica,Si, ,Nuevo,6,No,180
,,Robot Led Traje Niño Completo Con Cargador Bateria Control,MLA663119474,8500,57137813,GC-EVENTOS,3,2,Clásica,Si, ,Nuevo,6,No,118
,,Dolphin Hybrid Rs1,MLA612015811,11500,46119770,HIDRAULICARUBBER,4,2,Clásica,Si, ,Nuevo,6,Si,518
,,Robot Limpiapiscinas Dolphin S200 Nuevo Limpia Piso Y Pared!,MLA635204341,29930,176668703,MULTIMAKS,4,2,Clásica,Si, ,Nuevo,6,Si,335
,,Dolphin S50 Robot Automático Limpiafondo Nuevo Envio Gratis,MLA638783633,17913,82903588,MERCEDES821113,1,2,Clásica,Si, ,Nuevo,6,Si,306
,,Robot Limpia Fondo Dolphin S50 Limpia Piscina Pileta,MLA635291798,18909,190455921,SORBELLINISORBELLINI,2,2,Clásica,Si, ,Nuevo,6,Si,335
,,Robot Dolphin S200 Limpiafondo Automatico Piletas Piscinas,MLA636866505,31138,178546395,HIDROFILML,3,2,Clásica,Si, ,Nuevo,6,Si,322
,,Robot Aquabot Genesis,MLA611164853,28999,170800723,AQUACHLOR,1,2,Clásica,Si, ,Nuevo,6,Si,533
,,Limpia Piscinas Maytronics Dx3 Dolphin Robotic Envios A Caba,MLA622398537,20000,34459675,IVANAFOIGEL,3,2,Clásica,Si, ,Nuevo,6,No,442
,,"Barrefondo Automático,  Trepa Paredes Zodiac Baracuda Mx8",MLA617121977,16275,140554304,ROSARIOVICTORIASECRE,6,2,Clásica,Si, ,Nuevo,6,No,485
,,Robot Limpia Piscinas Dolphin S100 Envio Gratis Todo El Pais,MLA633544317,24300,98215394,FERRETERIAPACHECO,98,2,Clásica,Si, ,Nuevo,6,Si,349
,,Robot De Leds--completo,MLA612800192,14000,186270170,ANDYFREAKYBOY,1,2,Clásica,Si, ,Nuevo,6,No,514
,,Limpia Fondo Automático Acuatic Explorer,MLA638327243,5342,206100902,SANITARIOSFAM.,2,2,Clásica,Si, ,Nuevo,6,No,310
,,Robot Limpia Piscinas Dolphin S50,MLA643653541,17488,179886566,TECNOPLAST1,2,2,Clásica,Si, ,Nuevo,6,Si,269
,,Robots Dolphin S-50 Limpia Piscinas (ing Maschwitz),MLA636323186,19675,184399251,FERRETERIAELMOLINO,5,2,Clásica,Si, ,Nuevo,6,No,326
,,Robot Barrefondo Dolphin S300i C/bluetooth,MLA611859274,33170,192024156,DACLOR-PISCINAS,1,2,Clásica,Si, ,Nuevo,6,No,518
,,Robot Limpia Fondo P/pileta Dolphin E10.salvador Pinturerias,MLA636944633,17990,77788421,PASTE77,2,2,Clásica,Si, ,Nuevo,6,No,322
,,Robot Aspiradora Inteligente D75 Neato - Prestigio,MLA654499363,15000,165962418,PRESTIGIO STORE,6,1,Clásica,Si,Prestigio,Nuevo,6,No,181
,,Robot Hexapodo 18 Dof Completo Arduino Android Bluetooth,MLA615293707,11350,24166266,SISTEMSOFTS,4,1,Clásica,Si, ,Nuevo,6,No,499
,,Robot Perro Inteligente Chip Espectacular A Pedido!!!,MLA644165240,9500,90952429,PS3ARGENTINA,1,1,Clásica,Si, ,Nuevo,6,No,265
,,R2 D2 Star Wars - Inteligente - Tablet Y Celu - Usa - New,MLA672406426,5000,250851701,GOODBOYSMG,1,1,Clásica,Si, ,Nuevo,6,Si,49
,,"Robot Oruga, Chasis 4 Motores,raspberry Camara",MLA673433165,5990,24166266,SISTEMSOFTS,3,1,Clásica,Si, ,Nuevo,6,No,42
,,Robot De Programación Wonder Dash Y Dot Fact. A/b,MLA616229629,"7799,9",74016573,SISTECO-WEB,30,1,Clásica,Si, ,Nuevo,6,No,492
,,Robot Makeblock Mbot Ranger,MLA641652920,7200,52923437,LITTLEBITS ARGENTINA,2,1,Clásica,Si, ,Nuevo,6,No,285
,,Aspiradora Robot Inteligente Automatica Neato D85 Limpiadora,MLA653516750,"19073,25",179035500,HIDROAL,19,1,Clásica,Si, ,Nuevo,6,Si,188
,,Aspiradora Robot Neato Botvac D85 Programable Laser Spinflow,MLA669488959,18900,75482619,ANSILA,2,1,Clásica,Si, ,Nuevo,6,Si,71
,,Robot Limpia Piscina Barrefondo Automático Aquabot I2,MLA648059465,12990,83417473,PINTURERIASMM,19,1,Premium,Si,Pinturerias MM,Nuevo,6,Si,232
,,Robot Dolphin S200 Limpia Pileta En Mendoza,MLA642600376,27199,161990496,DTODOAGUA,1,1,Clásica,Si, ,Nuevo,6,Si,277
,,Robot Aspiradora Neato D85 El Mas Potente No Irobot,MLA665392263,17640,73830462,WATERCENTER,15,1,Clásica,Si, ,Nuevo,6,Si,100
,,Robot Aspiradora Para Pisos -  Neato D85 - Con Garantía,MLA653080389,18900,226199021,ROBOTDEPILETAS,4,1,Clásica,Si, ,Nuevo,6,Si,191
,,Dolphin S50 Robot Limpiafondos Automatico Envio Gratis Ftvo,MLA675408904,18908,183978307,ILUMINAUDIO.,10,1,Clásica,Si, ,Nuevo,6,Si,26
,,Robot Espa Aquabot Supreme -  Zona Sur Banfield,MLA660329578,23150,46119770,HIDRAULICARUBBER,3,1,Clásica,Si, ,Nuevo,6,Si,139
,,Barredor Aspiradora Robot Neato D85 Superior Al Roomba,MLA649146096,17300,190455921,SORBELLINISORBELLINI,1,1,Clásica,Si, ,Nuevo,6,Si,222
,,Robots Dolphin S-200 Limpia Piscinas - Pared (ing Maschwitz),MLA650621160,31140,184399251,FERRETERIAELMOLINO,2,1,Clásica,Si, ,Nuevo,6,No,211
,,Robot Limpia Piletas Dolphin S200 Vendedor Oficial La Plata,MLA659280997,29930,192273152,SELECTOARG,1,1,Clásica,Si, ,Nuevo,6,Si,146
,,Robot Espa Aquabot Genesis -  Zona Sur Banfield,MLA660329653,24350,46119770,HIDRAULICARUBBER,1,1,Clásica,Si, ,Nuevo,6,Si,139
,,Robot Aspiradora Neato D75 La Mas Potente Del Mercado Eftvo,MLA675767356,13200,183978307,ILUMINAUDIO.,9,1,Clásica,Si, ,Nuevo,6,No,23
,,Wall-e U-command Control Robot Remoto Bunny Toys,MLA604509207,"6999,9",61013030,JUGUETERIABUNNYTOYS,1,1,Clásica,Si, ,Nuevo,6,No,557
,,Robot Dolphin Para Piscina S200 Serie S Limpia Fondo Pileta,MLA665934455,27680,255273266,BID ARGENTINA,2,1,Clásica,Si, ,Nuevo,6,No,97
,,Auto Robot A Bateria Luces Musica Mp3 Control Remoto Oferta!,MLA668812377,6999,24628288,TIEMPOLIBRE2211,2,1,Clásica,Si, ,Nuevo,6,No,76
,,Motor Pivotante Batiente Robot Seg 1/2hp,MLA663430674,10999,234595009,INSURSERVICIOS,9,1,Clásica,Si, ,Nuevo,6,No,115
,,Catfish Limpia Fondo Pileta Aspiradora A Bateria,MLA671807384,8900,92615811,INNOVATIONSARG,100,1,Clásica,Si, ,Nuevo,6,No,54
,,Zancos De Aluminio Durlock Knauf Robot Led,MLA641513499,5399,157910377,DURFACIL,10,1,Clásica,Si, ,Nuevo,6,No,286
,,Limpiafondo Dolphin S300i Bluetooth,MLA675032972,33170,97104203,SERVITEK_AR,99,1,Clásica,Si, ,Nuevo,6,No,29
,,Digitech Dirty Robot Stereo Mini* A Pedido En35dias Sin Seña,MLA675224398,5499,73824703,INOVAMUSICNET.COM,2,1,Clásica,Si, ,Nuevo,6,No,28
,,Robot Aspiradora Inteligente Neato D85 - Envio Gratis,MLA648128442,18900,48140082,BLADEARGENTINA,4,1,Clásica,Si, ,Nuevo,6,Si,232
,,Irobot Roomba 790 + Centro Control Inalámbrico + Valija Acc.,MLA648496104,"24999,99",7195201,DAN_AYKROYD,1,1,Clásica,Si, ,Nuevo,6,No,228
,,Robot Cozmo Anki Envio Gratis A Todo El Pais,MLA667039137,7399,236399079,APRALVENTAS,3,1,Clásica,Si, ,Nuevo,6,Si,88
,,Robot Limpia Piscina Pileta Dolphin S100 Precio -10% Off,MLA653467148,23403,73830462,WATERCENTER,4,1,Clásica,Si, ,Nuevo,6,Si,189
,,Robot Limpia Piscinas Dolphin E10,MLA639196864,18362,179886566,TECNOPLAST1,1,1,Clásica,Si, ,Nuevo,6,Si,303
,,Robot Limpia Piscinas Dolphin S200 En La Plata Envio Gratis,MLA638601891,29930,143487279,HIDROPLAT,1,1,Clásica,Si, ,Nuevo,6,Si,308
,,Robot Dolphin S50 Limpia Piscina Fondo Envio Gratis,MLA636654508,18910,152258468,BOMBASFAL SRL,1,1,Clásica,Si, ,Nuevo,6,Si,324
,,Robot Dolphin S100 - Barrefondo - Robot De Piletas,MLA633253544,24300,226199021,ROBOTDEPILETAS,19,1,Clásica,Si, ,Nuevo,6,Si,351
,,Robot Dolphin S50 - Barrefondo - Robot De Piletas,MLA633287457,19675,226199021,ROBOTDEPILETAS,19,1,Clásica,Si, ,Nuevo,6,Si,350
,,Robot Limpia Piscinas Diagnostic Wonder Cady De Regalo,MLA639199112,29048,179886566,TECNOPLAST1,1,1,Clásica,Si, ,Nuevo,6,Si,303
,,Robot Barrefondo Acuatic Explorer Limpia Piscina Automatico,MLA638783518,5900,46772732,TIOSOHOGAR,994,1,Clásica,Si, ,Nuevo,6,No,306
,,Wall E Wall-e Walle Disney Pixar Robot Eve Eva Transformer,MLA613555735,7000,99571488,KAM_VILLA,1,1,Clásica,Si, ,Nuevo,6,No,510
,,Robot Led Traje,MLA613242477,17000,29797051,JUANDHIEGO2010,1,1,Clásica,Si, ,Nuevo,6,No,512
,,"Robot Barrefondo,  Trepa Paredes Zodiac Baracuda Mx8",MLA610101185,16275,140554304,ROSARIOVICTORIASECRE,6,1,Clásica,Si, ,Nuevo,6,No,527
,,Robot Led Traje Unico El Mejor Exelente Inversion,MLA612426362,18000,4616555,FACEMEGALED VANKLEY,1,1,Clásica,Si, ,Nuevo,6,No,516
,,Sphero Bb-8 Robot Star Wars Disney Original Android,MLA614012702,6800,25865111,SAFTOYS,99,1,Clásica,Si, ,Nuevo,6,No,507
,,Motor Automático Porton Pivotante Peccinin Robot Ferrecent,MLA623391327,16890,86902629,FERRECENT,99,1,Clásica,Si, ,Nuevo,6,No,434
,,Robot Dolphin S50 Limpia Fondo Pileta Barrefondo Gtia 1 Año,MLA638835763,17488,182441201,PINTURERIA PEREZ,1,1,Clásica,Si, ,Nuevo,6,Si,306
,,Robot Dolphin S50 Limpiafondo Automático Para Piletas,MLA646099141,18900,170800723,AQUACHLOR,1,1,Clásica,Si, ,Nuevo,6,No,248
,,"Zancos Drywall Stilts Rojo (de Aluminio, Durlock, Robot Led)",MLA642621558,5399,234395003,DISTRIBUIDORALUCFRAN,1,1,Clásica,Si, ,Nuevo,6,No,277
,,Robot Astronauta Pila Japon Unico Nuevo 1960 Lloretoys,MLA619863351,5700,92209428,JUGUETES LLORET,1,1,Clásica,Si, ,Nuevo,6,No,463
,,Robot Aquabot Pool Rover Para Limpieza Piletas Oferta!!,MLA617708454,8999,170800723,AQUACHLOR,1,1,Clásica,Si, ,Nuevo,6,Si,480
,,Robot Limpiapiscinas Aquabot Supreme,MLA641401226,27829,19764936,RPM MAQUINARIAS,1,1,Clásica,Si, ,Nuevo,6,No,287
,,Multi Procesadora Robot Coupe R101 3/4hp A Pedido! Excelente,MLA644998787,30000,90952429,PS3ARGENTINA,1,1,Clásica,Si, ,Nuevo,6,No,258
,,Robot Aquabot Rapids 4wd Barre Limpia Fondo Pileta Piscina,MLA619006422,24884,125457882,KONECTASANITARIOS,4,1,Clásica,Si, ,Nuevo,6,No,470
,,Muñeco Buzz Lightyear Ultimate Robot Programable. Toy Story,MLA605269734,8595,27420742,BABY KINGDOM,10,1,Clásica,Si, ,Nuevo,6,No,553
,,Robot Dolphin S50 Cordoba Capital,MLA652384738,18909,231371549,CERROCLORVENTAS,49,1,Clásica,Si, ,Nuevo,6,No,197
,,Robot Aspiradora Inteligente Neato D75,MLA672170600,14999,97104203,SERVITEK_AR,6,1,Clásica,Si, ,Nuevo,6,No,51
,,Limpia Piscinas Dolphin S100 Limpia Fondos Y Trepa Paredes,MLA636711083,22275,192083291,MUNDOHIGIENE,9997,1,Clásica,Si, ,Nuevo,6,Si,323
,,Muñeco Interactivo Chewbacca Arco Y Morral 45cm Original,MLA609602014,5990,164600480,CITYKIDS OFICIAL,1,0,Clásica,Si,Citykids,Nuevo,6,No,533
,,Dash Robot + Lanzador De Pelotas,MLA661159310,5500,67999873,OPENARG,1,0,Clásica,Si, ,Nuevo,6,Si,132
,,Robot Cozmo Inteligente C/ Emociones Inteligencia Artificial,MLA669281512,8999,176500829,CUARTITO AZUL,1,0,Clásica,Si, ,Nuevo,6,No,72
,,"Robot Star Wars R2 D2 Celular, ",MLA657975736,5000,58196774,FABIHAN_DRA,1,0,Clásica,Si, ,Nuevo,6,No,155
,,Robot Dinosaurio Miposaur Inteligente Cuartito Azul,MLA669267938,5990,176500829,CUARTITO AZUL,2,0,Clásica,Si, ,Nuevo,6,No,72
,,Star Wars R2d2 Radio Control Electronico,MLA672542065,"9649,9",187707929,PUMBA_LA_LUMBA,1,0,Clásica,Si, ,Nuevo,6,No,48
,,"Gizmos & Gadgets Kit, 2ª Edición",MLA677711620,5200,161703332,AFTECH.CORP.ARG,1,0,Clásica,Si,Parrot,Nuevo,6,No,9
,,Littlebits Synth Kit,MLA678260089,5000,161703332,AFTECH.CORP.ARG,1,0,Clásica,Si,Parrot,Nuevo,6,No,5
,,Kit Robot Programable Similar Arduino - Piezas De Aluminio,MLA616014960,6900,43270615,JIMYTHEKID,1,0,Clásica,Si, ,Nuevo,6,No,493
,,Figura Pvc Sera-chan Yamashita Entrego Ya!!!!!!!!!!!!!!!!!!!,MLA610264388,5500,152227860,WOLVERINE171,1,0,Clásica,Si, ,Nuevo,6,No,526
,,Voodoo Lab Ground Control Pro M* Sin Stock* A Pedido 35días!,MLA677624918,14499,73824703,INOVAMUSICNET.COM,2,0,Clásica,Si, ,Nuevo,6,No,10
,,Robot Buzz Lightyear Pelicula Toy Story Control Remoto Doble,MLA606116115,5899,27420742,BABY KINGDOM,11,0,Clásica,Si, ,Nuevo,6,No,548
