,,Título,Id,Precio,IdSeller,Nickname,Stock,Cantidad Ventas,Exposicion,MercadoPago ,T. Oficial,Condición,Cuotas,Envío Gratis,Días publicados
,,Triturador Robot Coupe Modelo Micromix Tubo Acero Inoxidable,MLA662731438,8900,237839123,TIENDA ACERO,1,0,Clásica,Si, ,Nuevo,6,No,120
,,Robot Dolphin S200 Aguas De Leloir.,MLA637731673,27680,98826960,AGUASDELELOIR,1,0,Clásica,Si, ,Nuevo,6,No,315
,,Robot Dolphin E10 Piso,MLA678396817,19250,242855904,MAQUINAS.COM,1,0,Clásica,Si, ,Nuevo,6,No,5
,,I-robot Para Baldear Baño Y Cocina - Scooba 230,MLA676535845,8900,210329375,PORO4833344,1,0,Clásica,Si, ,Nuevo,6,No,18
,,Kit  Porton Automatico Pivotante Bbs Robot 1 Hoja Hasta 6mt,MLA672543986,9800,81442244,360 SISTEMAS DE SEGURIDAD,10000,0,Clásica,Si, ,Nuevo,6,No,48
,,Robot Starwars R2 D2 Arturo Alcancia Electrica Para Iphone 5,MLA607343509,5000,151389331,ELCAPODENEXTEL,2,0,Clásica,Si, ,Nuevo,6,No,541
,,Robot Dolphin S200 + Regalo!,MLA643254149,31140,194859139,PILETAS CRISCI,1,0,Clásica,Si, ,Nuevo,6,No,272
,,Robot Starwars R2 D2 Arturito Guerra De Las Galaxias R2d2,MLA629882773,7351,151389331,ELCAPODENEXTEL,2,0,Clásica,Si, ,Nuevo,6,No,379
,,Robot Starwars R2-d2 Arturito Guerra De Las Galaxias Miralo,MLA629883124,5500,151389331,ELCAPODENEXTEL,2,0,Clásica,Si, ,Nuevo,6,No,379
,,Robot Aquabot Rapid 4wd - Trepa Paredes - Piletas Hasta 15 M,MLA609828658,"24499,25",183693864,EBR_ELECTROBOMBAS_ROSARIO,3,0,Clásica,Si, ,Nuevo,6,Si,528
,,Robot Starwars R2.d2 Arturito Guerra De Las Galaxias Ver#7,MLA604118703,7350,151389331,ELCAPODENEXTEL,2,0,Clásica,Si, ,Nuevo,6,No,560
,,Venetian Vs-2065 Scan Beam 5r Robot Dj Efecto Potente,MLA626778348,14900,10034731,DMX SRL,15500,0,Clásica,Si, ,Nuevo,6,No,406
,,Robot Star Wars R2-d2 Interactive Electronic Bank Coleccion,MLA605865217,5000,151389331,ELCAPODENEXTEL,2,0,Clásica,Si, ,Nuevo,6,No,549
,,Robot Star Wars R2d2 Arturo Articulo De Coleccion Nuevo Caja,MLA603680256,5250,151389331,ELCAPODENEXTEL,2,0,Clásica,Si, ,Nuevo,6,No,562
,,Robot Limpia Piscinas Barrefondo Piso Y Paredes Dolphin S200,MLA637366489,29064,34120743,TODOFERRETERIA,10,0,Clásica,Si, ,Nuevo,6,No,318
,,Robot Star Wars R2d2 Pieza Para Coleccionistas Nuevo 0km,MLA630721700,5251,151389331,ELCAPODENEXTEL,2,0,Clásica,Si, ,Nuevo,6,No,372
,,4 Unidades Cabezal Movil 7 Led Dmx Rgbw Robot Tecno Cooler,MLA676746120,9400,49843944,TECNO COOLER,10,0,Clásica,Si, ,Nuevo,6,No,16
,,Robot Star-wars R2-d2 Interactiv Bank Electronic Nuevo 0km,MLA603466288,5250,151389331,ELCAPODENEXTEL,2,0,Clásica,Si, ,Nuevo,6,No,563
,,Cozmo - Robot Masc. C/ Inteligencia Artificial Video Muestra,MLA669957946,8000,93029020,VIRO Q.,1,0,Clásica,Si, ,Nuevo,6,No,68
,,Robot Star Wars R2-d2 Interactive Electronic Bank Banco R2d2,MLA607911559,5000,151389331,ELCAPODENEXTEL,2,0,Clásica,Si, ,Nuevo,6,No,538
,,Acuatic Explorer Up Limpia Piscina Automático,MLA666922647,5890,191938231,MOBY_ARG,2,0,Clásica,Si, ,Nuevo,6,No,89
,,Robot Star Wars R2d2 Arturo Articulo De Coleccion En Caja,MLA607343584,5000,151389331,ELCAPODENEXTEL,2,0,Clásica,Si, ,Nuevo,6,No,541
,,Philips Msr 1200w Sa  Lampara Descarga Robot Cabezal Movil,MLA605198794,"7027,68",10034731,DMX SRL,2,0,Clásica,Si, ,Nuevo,6,No,533
,,Robot Limpiapiscinas Dolphin Serie S - 100 Envio Gratis     ,MLA677928415,21599,243995532,CASAFERNANDES_ML,3,0,Clásica,Si, ,Nuevo,6,No,8
,,Robot Limpiapiscinas Dolphin Serie S - 200                  ,MLA677928437,27680,243995532,CASAFERNANDES_ML,3,0,Clásica,Si, ,Nuevo,6,No,8
,,Robot Limpiapiscinas Dolphin Serie S - 50 Envio Gratis      ,MLA677857356,18362,243995532,CASAFERNANDES_ML,3,0,Clásica,Si, ,Nuevo,6,No,8
,,Fuente De Alimentación Pra Robot Dolphin Pro X2  Cod:9995671,MLA673269112,5227,161990496,DTODOAGUA,1,0,Clásica,Si, ,Nuevo,6,No,43
,,¡¡ Sin Stock !! Chogokin Mazinger Z Getter Robot Color,MLA671045830,5900,147541309,MYTH JAPAN,1,0,Clásica,Si, ,Nuevo,6,No,60
,,Robot Irobot Aspiradora Roomba 780 Hasta 80m2 Om,MLA631581131,18690,148742811,FACHA2407,10,0,Clásica,Si, ,Nuevo,6,No,364
,,Motor Pivotante Batiente Robot Seg 1/2hp,MLA659832179,10999,77592540,COLBEN,10,0,Clásica,Si, ,Nuevo,6,No,142
,,Combo Cabezal Movil Led Robot X 12w Rgbw,MLA652606034,10500,242787378,LUTO7213896,1,0,Clásica,Si, ,Nuevo,6,No,195
,,Martin Roboscan 812 Robot 150w Efecto Dmx,MLA612252191,7500,48326493,TECNOSHOWVELASCO,1,0,Clásica,Si, ,Nuevo,6,No,516
,,Limpiadores De Piscina Residencial Dolphin E10 Asi,MLA629055960,20690,148742811,FACHA2407,10,0,Clásica,Si, ,Nuevo,6,No,386
,,Limpia Fondo Barrefondo Max Water Tech Corp No Dolphin,MLA669282942,12800,92615811,INNOVATIONSARG,300,0,Clásica,Si, ,Nuevo,6,No,72
,,Limpia Fondo Pileta Max Baterias No Dolphin,MLA669857905,12800,92615811,INNOVATIONSARG,200,0,Clásica,Si, ,Nuevo,6,No,69
,,Robot Star Wars R2d2 Interactivo Banco Electronic Nuevo Caja,MLA604289827,5000,8640722,GUYBRUSHT,2,0,Clásica,Si, ,Nuevo,6,No,559
,,Robots Interactivos Para Ninos Wonder Workshop Dash&dot Cig,MLA669743074,8690,148742811,FACHA2407,10,0,Clásica,Si, ,Nuevo,6,No,70
,,Limpiadores De Piscina Residencial Profesional Dolphin Asi,MLA629056278,28890,148742811,FACHA2407,10,0,Clásica,Si, ,Nuevo,6,No,386
,,Kit Automatizacion De Porton Pivotante A Rueda Bbs Robot 600,MLA672694492,12500,194638115,CERRAJERIA GABY,999,0,Clásica,Si, ,Nuevo,6,No,47
,,Cabezal Movil Iluminacion Led Robot Gtd Lm621,MLA603514809,28750,40941360,MUSICAL BLUE,1,0,Clásica,Si, ,Nuevo,6,No,563
,,Limpiadores Piscina Residencial Dolphin Diagnostic Pvc Asi,MLA629056720,34790,148742811,FACHA2407,10,0,Clásica,Si, ,Nuevo,6,No,386
,,Espa Limpiador De Piscina Aquabot Supreme Rdo,MLA651499108,32690,148742811,FACHA2407,10,0,Clásica,Si, ,Nuevo,6,No,203
,,Robot Limpia Piletas U$s 649,MLA660313714,9999,764685,ASSAAD,1,0,Clásica,Si, ,Nuevo,6,No,139
,,Limpiafondo Automatico Dolphin S100,MLA650345540,23500,183227876,HIDRAULICASARANDI,1,0,Clásica,Si, ,Nuevo,6,No,213
,,Juguetes Wonder Dash 29,MLA657206336,"5611,13",148089117,FUTUROINFORMATICASRL,3,0,Clásica,Si, ,Nuevo,6,No,160
,,Chassis Robot Lynxmotion Completo Nuevo,MLA671059200,6000,243038082,FRAR9438696,1,0,Clásica,Si, ,Nuevo,6,No,60
,,Robot Dolphin Barre Fondo S50 Limpia Piscina Pileta,MLA658572921,17299,45984353,PABLOEZEHERRERO,1,0,Clásica,Si, ,Nuevo,6,No,151
,,"Dolphin S-100 , Limpia Piscinas..robot Trepa Paredes",MLA666736084,21650,213074973,PISCINASEST.GRANDE,3,0,Clásica,Si, ,Nuevo,6,No,91
,,Robot Interactivo Arturito R2d2 Ar2r2 Ar2t2 De Star Wars,MLA615065228,7500,95678347,GALLEGO CATALANO,2,0,Clásica,Si, ,Nuevo,6,No,501
,,Robot Piscinas S5 Suelo Y Pared Hidraulico Astral Pool. Caja,MLA672049880,13499,29856053,PALMENMAJO,1,0,Clásica,Si, ,Nuevo,6,No,52
,,Robot Piscina Aquabot Rapids 4wd Piso Y Paredes,MLA642341582,22500,184386090,STIBINGENIERIA,1,0,Clásica,Si, ,Nuevo,6,No,279
,,Robot Dolphin S200 Limpiafondo Automático Para Piletas,MLA646108746,29900,170800723,AQUACHLOR,1,0,Clásica,Si, ,Nuevo,6,No,248
,,Limpiafondo Automatico Dolphin S200,MLA650346684,29935,183227876,HIDRAULICASARANDI,1,0,Clásica,Si, ,Nuevo,6,No,213
,,Kit Robot Programable Similar Arduino,MLA633940747,5200,41878430,LUCHIRIDIUM,1,0,Clásica,Si, ,Nuevo,6,No,345
,,Dolphin Robot Limpiapiletas E 10 Nuevo,MLA667202892,14200,77889238,ADRIHORM,1,0,Clásica,Si, ,Nuevo,6,No,87
,,Walle Wall E Robot Wall-e Construct Pixar Original Nene Nena,MLA613555716,5000,99571488,KAM_VILLA,1,0,Clásica,Si, ,Nuevo,6,No,510
,,Robot Dolphin S200. Limpia Fondo Para Piscina,MLA668877130,28370,169272784,HIDROVENTSRL,1,0,Clásica,Si, ,Nuevo,6,No,75
,,Aspiradora Stanley 60 Litros 1950w,MLA676929948,"7299,99",183812883,MARCELO CREUS,1,0,Clásica,Si, ,Nuevo,6,No,15
,,Robot Dolphin S100 Limpia Piscina Pileta Barre Fondo,MLA652447753,24300,128836887,MINUSTECHNOLOGY,10,0,Clásica,Si, ,Nuevo,6,No,196
,,Indominus Rex Zoomer Robot Jurassic World,MLA677688852,6000,60747404,CAROLINIITAA,1,0,Clásica,Si, ,Nuevo,6,No,9
,,Espa Limpiador De Piscina Aquabot Rapid 4wd Rdo,MLA623077535,28590,148742811,FACHA2407,10,0,Clásica,Si, ,Nuevo,6,No,437
,,Robot Interactivo Arturito R2d2 Ar2r2 Ar2t2 Star Wars Nuevo,MLA659569521,8503,95678347,GALLEGO CATALANO,2,0,Clásica,Si, ,Nuevo,6,No,144
,,Robot Dolphin S200 Limpia Piscina Pileta Barre Fondo,MLA652447867,31140,128836887,MINUSTECHNOLOGY,10,0,Clásica,Si, ,Nuevo,6,No,196
,,Robot Dolphin S50 Limpia Piscina Pileta Barre Fondo,MLA652448479,19674,128836887,MINUSTECHNOLOGY,10,0,Clásica,Si, ,Nuevo,6,No,196
,,Robot De Limpieza-,MLA676236937,7800,146521733,CAMILADALLAVECCHIA,1,0,Clásica,Si, ,Nuevo,6,No,20
,,"Robot Cozmo Inteligente, Ultimo En Stock!!",MLA671533555,8000,37027966,LEAN.ALIAS2011,1,0,Clásica,Si, ,Nuevo,6,No,56
,,Robot Limpiapiscinas - Línea Residencial Dolphin S 50,MLA650054876,22990,230738339,CLOROMASROLDAN,1,0,Clásica,Si, ,Nuevo,6,No,215
,,Robot Aquabot Rapids 4wd  ,MLA671233448,"31181,17",151442994,ELMUNDODELPLOMERO,3,0,Clásica,Si, ,Nuevo,6,No,59
,,Robot Apex Iv. Para Inyectora U Otras Maquinas,MLA673936638,30000,85415659,DANITO221,1,0,Clásica,Si, ,Nuevo,6,No,37
,,Triturador Robot Coupe Modelo Mini Mp 240 V.v. Pie Removible,MLA662732367,19000,237839123,TIENDA ACERO,1,0,Clásica,Si, ,Nuevo,6,No,120
,,Nuevos Robots Para Facebook Messenger Chatbot,MLA655887099,15000,89801872,ARTIFISICO,1,0,Clásica,Si, ,Nuevo,6,No,170
,,Kit Automatizador Porton Pivotante Bbs Robot Hoja Hasta 6mt,MLA672543545,9800,81442244,360 SISTEMAS DE SEGURIDAD,10000,0,Clásica,Si, ,Nuevo,6,No,48
,,Pinza Neumatica Tipo Festo Robotica Automatizacion Cnc Robot,MLA665402775,7160,11871175,78930,1,0,Clásica,Si, ,Nuevo,6,No,100
,,Robot Dolphin E10 Barrefondo Piletas Piscinas Nuevo Modelo!!,MLA631815341,18362,96320494,TECNOG MORENO,1,0,Clásica,Si, ,Nuevo,6,No,362
,,Zanco Rojo Durlock Robot Envios Cercanos Gratis,MLA660510624,5800,217286642,PROSANFERR,10,0,Clásica,Si, ,Nuevo,6,No,137
,,Robot Aspiradora Neato D75,MLA673818342,29950,83655067,ANDREWS8073,1,0,Clásica,Si, ,Nuevo,6,No,38
,,Triturador Robot Coupe Modelo Cmp 350 V.v.,MLA662733254,19650,237839123,TIENDA ACERO,1,0,Clásica,Si, ,Nuevo,6,No,120
,,Vendo Robots De Led. Envios A Todo El Pais,MLA670131749,20000,56298667,LAUREANO ANDRES,1,0,Clásica,Si, ,Nuevo,6,No,67
,,Robot Interactivo Arturito R2d2 Ar2r2 Ar2t2 Star Wars Nuevo,MLA609021356,7500,95678347,GALLEGO CATALANO,2,0,Clásica,Si, ,Nuevo,6,No,532
,,Robot Led,MLA666346363,16500,203060913,GOBR1411673,1,0,Clásica,Si, ,Nuevo,6,No,93
,,Buzz Lightyear Guardian Del Espacio Robot A Control Remoto,MLA606116134,5899,27420742,BABY KINGDOM,11,0,Clásica,Si, ,Nuevo,6,No,548
,,Robot Interactivo De Star Wars Arturito R2d2 Ar2r2 Ar2t2,MLA629425434,8501,95678347,GALLEGO CATALANO,2,0,Clásica,Si, ,Nuevo,6,No,383
,,Robot De Star Wars Interactivo Arturito R2d2 Ar2r2 Ar2t2,MLA630431687,8501,95678347,GALLEGO CATALANO,2,0,Clásica,Si, ,Nuevo,6,No,374
,,Robot Aspiradora Inteligente D75 Neato. Envio Gratis!!,MLA669301679,15745,194859139,PILETAS CRISCI,1,0,Clásica,Si, ,Nuevo,6,No,72
,,Robot De Cocina Thermomixer T-1000 Smart - Tek + Accesorios ,MLA677980171,6500,216641123,ESCAMES HNOS,2,0,Clásica,Si, ,Nuevo,6,No,7
,,Digitech Dirty Robot Guitar Eff* Sin Stock* A Pedido 35días!,MLA677625206,6099,73824703,INOVAMUSICNET.COM,2,0,Clásica,Si, ,Nuevo,6,No,10
,,Robot Dolphin S50 + Regalo!,MLA633006029,19675,194859139,PILETAS CRISCI,4,0,Clásica,Si, ,Nuevo,6,No,352
,,Robot Didactico Para Escuelas Tecnicas,MLA652656575,16000,130963994,LUMINAYRES,1,0,Clásica,Si, ,Nuevo,6,No,195
,,Muñeco Buzz Lightyear U-command Robot Programable. Toy Story,MLA606116096,5899,27420742,BABY KINGDOM,11,0,Clásica,Si, ,Nuevo,6,No,548
,,Gtd-lm621 - Cabezal Movil Iluminacion Led Robot,MLA673637886,"27976,77",152460635,TIENDAFEEDBACK,1,0,Clásica,Si, ,Nuevo,6,No,40
,,Robot De Cocina Thermomixer Smart Tek  Y Garantía,MLA678231636,6999,57784489,TECNO-STORES,10,0,Clásica,Si, ,Nuevo,6,No,6
,,Satarii Swivl Robot,MLA647357080,15218,76310627,BIBLIOTECADELMUSICO,10,0,Clásica,Si, ,Nuevo,6,No,239
,,Robot Limpia Piscinas Supreme M3 Advanced,MLA675022075,21840,246348715,AGUAYBOMBASSRLAGUAYBOM,1,0,Clásica,Si, ,Nuevo,6,Si,29
,,Robot Dolphin S 100.,MLA641064925,22000,2499405,FOUNTAINMAN,4,0,Clásica,Si, ,Nuevo,6,No,289
,,Dolphin S50 Robot Bahia Blanca,MLA653120250,18600,219553287,CUATRO-ESTACIONES BAHIABLANCA,1,0,Clásica,Si, ,Nuevo,6,No,191
,,Robot Dolphin Supreme M3 Advance Barrefondo Piscina,MLA676118452,18990,265861958,VIDA JARDIN,1,0,Clásica,Si, ,Nuevo,6,No,21
,,Robot Limpiapiletas Dolphin S200,MLA649514941,27815,139726925,REVESTIMIENTOS ARGENTINOS,1,0,Clásica,Si, ,Nuevo,6,Si,219
,,Robot Aspiradora Inteligente Neato D85,MLA672170887,15999,97104203,SERVITEK_AR,6,0,Clásica,Si, ,Nuevo,6,No,51
,,Robot Aquabot Rapid 4wd - Trepa Paredes - Piletas Hasta 15 M,MLA609828674,24500,183693864,EBR_ELECTROBOMBAS_ROSARIO,3,0,Clásica,Si, ,Nuevo,6,Si,528
,,Robot Aspiradora Inteligente Neato D85 Limpia Pisos,MLA672397251,17300,192083291,MUNDOHIGIENE,9999,0,Clásica,Si, ,Nuevo,6,Si,49
,,Robot Aspiradora Inteligente Neato D75 Limpia Pisos,MLA672394215,14990,192083291,MUNDOHIGIENE,9999,0,Clásica,Si, ,Nuevo,6,Si,49
,,Robot Dolphin Limpia Pileta Barre Fondo Filtro M4 Pro Wb,MLA637540759,34859,26448669,EKKON EXPERTOS,1,0,Clásica,Si, ,Nuevo,6,Si,316
,,Robot Dolphin Limpia Pileta Barre Fondo Angulos Filtro S50,MLA637406533,17488,26448669,EKKON EXPERTOS,1,0,Clásica,Si, ,Nuevo,6,Si,318
,,Robot Dolphin Limpia Pileta Barre Fondo Filtro Angulos S200,MLA637407386,27680,26448669,EKKON EXPERTOS,1,0,Clásica,Si, ,Nuevo,6,Si,317
,,Robot Dolphin S50 Limpia Piscina Fondo Envio Gratis,MLA636710686,18035,192083291,MUNDOHIGIENE,9998,0,Clásica,Si, ,Nuevo,6,Si,323
,,Robot Dolphin Limpia Pileta Barre Fondo Filtro M4 Pro Pvc,MLA637442444,33219,26448669,EKKON EXPERTOS,2,0,Clásica,Si, ,Nuevo,6,Si,317
,,Robot Dolphin S200 Limpia Piscina Barrefondo Envio Gratis,MLA636711410,28545,192083291,MUNDOHIGIENE,9998,0,Clásica,Si, ,Nuevo,6,Si,323
,,Robot Limpia Piletas Dolphin S200 Envio Gratis Todo El Pais,MLA641440590,26815,97104203,SERVITEK_AR,1000,0,Clásica,Si, ,Nuevo,6,No,286
,,"Dvd : Robot Chicken Season 1 - Season 5 (gift Set, , 5 Disc)",MLA675911681,5309,161008662,ELBAZARDIGITAL_COM,2,0,Clásica,Si, ,Nuevo,6,No,22
,,Kit Motor Portón Pivotante Industriual Pivus Robot 1.5,MLA676942838,14999,240678704,ACCESOAUTOMATIZACIONES,1000,0,Clásica,Si, ,Nuevo,6,Si,15
,,Robot R2-d2 Interactivo 1000 Acciones Programabl,MLA677449634,6449,81009099,ARCAN4,1,0,Clásica,Si, ,Nuevo,6,No,12
,,Robot Aquabot Rapid 4wd - Trepa Paredes - Piletas Hasta 15 M,MLA609828676,24500,183693864,EBR_ELECTROBOMBAS_ROSARIO,3,0,Clásica,Si, ,Nuevo,6,Si,528
,,Robot Dolphin S200 Limpia Piscina Pileta Barre Fondo,MLA649442130,31140,128836887,MINUSTECHNOLOGY,10,0,Clásica,Si, ,Nuevo,6,No,219
,,Dolphin S100 Robot Limpia Piscinas,MLA649514877,22000,139726925,REVESTIMIENTOS ARGENTINOS,1,0,Clásica,Si, ,Nuevo,6,Si,219
,,Robot Limpiapiletas Dolphin S50,MLA649514888,17999,139726925,REVESTIMIENTOS ARGENTINOS,1,0,Clásica,Si, ,Nuevo,6,Si,219
,,Kit Motor Portón Pivotante Industriual Pivus Robot 2.0,MLA676943244,17999,240678704,ACCESOAUTOMATIZACIONES,1000,0,Clásica,Si, ,Nuevo,6,Si,15
,,Modulo Robots Accionador Cambios Easytronic,MLA677959247,8000,63372268,XAVIER_DARIO,1,0,Clásica,Si, ,Nuevo,6,No,8
,,Motor Bbs Pivotante Robot Kit Con Dos Controles,MLA678243946,8799,1648562,SASEGURIDAD,1,0,Clásica,Si, ,Nuevo,6,No,6
,,Robot Dolphin S100 Limpia Piscina Pileta Barre Fondo,MLA649441059,24300,128836887,MINUSTECHNOLOGY,10,0,Clásica,Si, ,Nuevo,6,No,219
,,Robot Aspirador Irobot Roomba 581 - Nuevo,MLA676544620,9900,210329375,PORO4833344,1,0,Clásica,Si, ,Nuevo,6,No,18
,,Dolphin 100 (canning),MLA637940073,25000,191430735,STEVENPSCINAS,1,0,Clásica,Si, ,Nuevo,6,No,314
,,Robot Barrefondo  Dolphin S50,MLA639658401,18909,231371549,CERROCLORVENTAS,50,0,Clásica,Si, ,Nuevo,6,No,300
,,Robot Dolphin S 50,MLA641063766,18000,2499405,FOUNTAINMAN,4,0,Clásica,Si, ,Nuevo,6,No,289
,,Robot Dolphin S300i Aguas De Leloir.,MLA634054455,34240,98826960,AGUASDELELOIR,1,0,Clásica,Si, ,Nuevo,6,No,344
,,Robot Dolphin S50 Aguas De Leloir.,MLA637730594,17488,98826960,AGUASDELELOIR,1,0,Clásica,Si, ,Nuevo,6,No,315
,,Robot Dolphin S200 Barrefondo Piscina Trepa Paredes,MLA676120176,32500,265861958,VIDA JARDIN,1,0,Clásica,Si, ,Nuevo,6,No,21
,,Acme Scanner Dynamo Mh-635s Robot Scan Luz Dmx Efecto Envio,MLA677354790,5780,91053721,UNDER-MUSIC,999,0,Clásica,Si, ,Nuevo,6,Si,12
,,Dolphin 50 (canning),MLA637939494,18000,191430735,STEVENPSCINAS,1,0,Clásica,Si, ,Nuevo,6,No,314
,,Robot Dolphin S50 Barrefondo Piscina,MLA676119419,20500,265861958,VIDA JARDIN,1,0,Clásica,Si, ,Nuevo,6,No,21
,,Traje Robot Led Diseño Exclusivo,MLA609202615,17000,137605681,WIFI_GRATIS2013,1,0,Clásica,Si, ,Nuevo,6,No,531
,,Droide Robótico Interactivo Star Wars Smart R2-d2 Celular,MLA651461431,7000,44049751,TUBESARG,1,0,Clásica,Si, ,Nuevo,6,Si,204
,,Robot Dolphin S50 Limpia Piscina Barrefondo Nueva Envió Caba,MLA646547169,18910,204229801,SAL PARK,1,0,Clásica,Si, ,Nuevo,6,Si,245
,,Traje De Robot Led Con Zancos,MLA673791717,13000,203168199,LSMOK,1,0,Gratuita,Si, ,Nuevo,6,No,38
,,Irobot Roomba 621 Aspiradora Robot De Limpieza Automatica,MLA673118889,30199,68509887,SUPERNOVA8,1,0,Gratuita,Si, ,Nuevo,6,Si,44
,,"Aspiradora Robot Conga, Aspira Y Limpia -mejor Que Roomba!-",MLA677016026,10999,43160377,MAC_TA,1,0,Gratuita,Si, ,Nuevo,6,Si,15
,,Triturador Micromix 220v. Robot Coupe,MLA625099432,7990,81208677,RDFMAQUINARIAS,1,0,Clásica,Si, ,Nuevo,6,No,419
,,Robot Dolphin S300i Limpia Piletas Con Bluetooth Con Caddy,MLA678670321,34440,255273266,BID ARGENTINA,1,0,Clásica,Si, ,Nuevo,6,Si,2
,,Venta De Robot Led Diseños Exclusivos Exelente Inversion,MLA612426519,15000,120627018,MEGALEDEVENTOS ARTISTA,1,0,Clásica,Si, ,Nuevo,6,No,516
,,Robot Dolphin S200 Limpia Piscina Automatico,MLA674217086,27000,177811031,SEPE5046070,1,0,Gratuita,Si, ,Nuevo,6,No,36
,,Robot Dolphin S300i Limpia Piscina Automatico,MLA674217334,32000,177811031,SEPE5046070,1,0,Gratuita,Si, ,Nuevo,6,No,35
,,Aspiradora Roomba Robot 780,MLA671375928,17000,173476156,ARIJULIO21,1,0,Gratuita,Si, ,Nuevo,6,No,57
,,Roomba 621 - Irobot,MLA671584007,8000,57667137,CLAUJUAN_DRA,1,0,Gratuita,Si, ,Nuevo,6,No,56
,,Robot Aquabot Rapid 4wd - Trepa Paredes - Piletas Hasta 15 M,MLA609828675,24500,183693864,EBR_ELECTROBOMBAS_ROSARIO,3,0,Clásica,Si, ,Nuevo,6,No,528
,,Robot Completo Caja I Motion Vw,MLA671246431,15000,209522356,GRECOMARIACRISTINA,1,0,Gratuita,Si, ,Nuevo,6,No,58
,,Dolphin Robot Limpia Piscinas S50,MLA671303744,15250,245041703,CAEIROWICAA,1,0,Gratuita,Si, ,Nuevo,6,No,58
,,Irobot Roomba 860 Robot Inteligente Aspiradora Limpia 15%off,MLA674371343,14999,97991618,BRUNO.MORUZZI,1,0,Gratuita,Si, ,Nuevo,6,No,34
,,Robot Dolphin S100 Limpia Piscina Automatico,MLA673453941,20000,177811031,SEPE5046070,1,0,Gratuita,Si, ,Nuevo,6,No,41
,,"Aspiradora Robot Conga, Aspira Y Limpia -mejor Que Roomba!-",MLA678560035,13990,127663451,ANDREAFABIANASURACE,1,0,Gratuita,Si, ,Nuevo,6,No,3
,,"Aspiradora Robot Conga, Aspira Y Limpia -mejor Que Roomba!-",MLA677603592,10999,127663451,ANDREAFABIANASURACE,1,0,Gratuita,Si, ,Nuevo,6,No,10
,,Robot Dolphin S 200 Limpia Piscinas Inteligente,MLA678424423,31140,56273162,AGUACLARA2009,1,0,Gratuita,Si, ,Nuevo,6,No,4
,,Robot Star Wars R2d2 Interactivo Banco Electronico Nuevo,MLA603298117,5000,8640722,GUYBRUSHT,1,0,Clásica,Si, ,Nuevo,6,No,564
,,Robot Dolphin S100 Limpia Piscinas,MLA676069808,23355,183062022,MUNDO-PILETAS,1,0,Gratuita,Si, ,Nuevo,6,No,22
,,Robot Dolphin S50 ,MLA678329357,17200,34010572,WAP SRL,1,0,Gratuita,Si, ,Nuevo,6,No,5
,,Aspiradora Robot Conga Slim 890 De Cecotec. Barre Y Aspira.,MLA678828860,8850,51792423,MARIANITA008,1,0,Gratuita,Si, ,Nuevo,6,No,1
,,Robot Star Wars R2d2 Interactivo Banco Electronico Nuevo 0km,MLA603298113,5000,8640722,GUYBRUSHT,1,0,Clásica,Si, ,Nuevo,6,No,564
,,Robot Dophin S50 Barre Fondo Automatico,MLA678277920,19675,161474027,GONPLANL,1,0,Gratuita,Si, ,Nuevo,6,No,5
,,Robot Dolphin S100,MLA678279162,24300,161474027,GONPLANL,1,0,Gratuita,Si, ,Nuevo,6,No,5
,,Robot Dolphin S50 Limpia Piscina Automatico,MLA673915007,17000,229668668,CACHIPAZ15,1,0,Gratuita,Si, ,Nuevo,6,No,37
,,Robot  Dolphin S200,MLA678280013,31140,161474027,GONPLANL,1,0,Gratuita,Si, ,Nuevo,6,No,5
,,Robot Dolphin S 300 I.,MLA674021337,34700,2499405,FOUNTAINMAN,1,0,Gratuita,Si, ,Nuevo,6,No,37
,,Robot Aspirador Autocleaner F550,MLA677990922,6700,160139258,PEAL5753841,1,0,Gratuita,Si, ,Nuevo,6,No,7
,,Dolphin S300i Robot,MLA671640681,33170,181898736,SELVASNATATORIOS,1,0,Gratuita,Si, ,Nuevo,6,No,55
,,Robot Dolphin S100 Limpiapiscinas Tigre,MLA677519416,24300,267310228,CLIMAY PISCINAS,1,0,Gratuita,Si, ,Nuevo,6,No,11
,,"Robot Led, Mascara, Pechera, Brazos Y Pantalón.",MLA678355988,30000,90369680,EMANUELLEANDROPRODUCCIONES,1,0,Gratuita,Si, ,Nuevo,6,No,5
,,Robot Dolphin S 200,MLA674021480,27500,2499405,FOUNTAINMAN,1,0,Gratuita,Si, ,Nuevo,6,No,37
,,Robot Dolphin E10 Oferta Ultima Unidad Rosario Envio Gratis,MLA671689737,17250,246348715,AGUAYBOMBASSRLAGUAYBOM,1,0,Gratuita,Si, ,Nuevo,6,Si,55
,,Robot Dolphin,MLA675633371,31500,75504287,CARANFER,1,0,Gratuita,Si, ,Nuevo,6,No,24
,,Robot Limpia Piscinas. Oferta,MLA677675969,17800,259065302,KETEASA,1,0,Gratuita,Si, ,Nuevo,6,No,9
,,Robot Limpia Piscina Dolphin S300i Con Caddy,MLA678453969,34900,50727087,GRIJA2016,1,0,Gratuita,Si, ,Nuevo,6,No,4