,,Título,Id,Precio,IdSeller,Nickname,Stock,Cantidad Ventas,Exposicion,MercadoPago ,T. Oficial,Condición,Cuotas,Envío Gratis,Días publicados
,,Robot Buzz Lightyear Ultimate A Control Remoto Interactivo,MLA605269748,8595,27420742,BABY KINGDOM,11,0,Clásica,Si, ,Nuevo,6,No,553
,,Buzz Lightyear Guardian Del Espacio Robot A Control Remoto,MLA605269769,8595,27420742,BABY KINGDOM,11,0,Clásica,Si, ,Nuevo,6,No,553
,,"Buzz Robot Habla,camina,se Mueve,baila.nuevo 2016 Original",MLA606116038,5899,27420742,BABY KINGDOM,11,0,Clásica,Si, ,Nuevo,6,No,548
,,Robot Buzz Lightyear U-command A Control Remoto Interactivo,MLA606116056,5899,27420742,BABY KINGDOM,11,0,Clásica,Si, ,Nuevo,6,No,548
,,Robot Aspirador Neato Botvac Connected,MLA657061852,24120,46119770,HIDRAULICARUBBER,7,0,Clásica,Si, ,Nuevo,6,Si,161
,,Aspiradora Robot Inteligente Neato Botvac D85 Inalámbrica,MLA654318543,17640,9937333,FERRETERIACENTRALSRL,1,0,Clásica,Si, ,Nuevo,6,Si,183
,,Robot Aspiradora Inteligente Neato D75 - Envio Gratis,MLA648128130,16380,48140082,BLADEARGENTINA,5,0,Clásica,Si, ,Nuevo,6,Si,232
,,Irobot Roomba 780 Vacuum Limpieza Pisos Caja Cerrada Nuevo ,MLA674941615,15500,251456670,VKALIM,4,0,Clásica,Si, ,Nuevo,6,Si,30
,,Aspiradora Robot Inteligente Smart-tek Ava Mini Ramos Mejia,MLA668396389,"7999,99",195827973,MEIMPORTOEMPRESA,499,0,Clásica,Si, ,Nuevo,6,Si,79
,,Robot Aspiradora Inteligente Neato D75 Limpia Piso,MLA647409164,14999,7625198,SANITARIOS-ARIETA,999,0,Clásica,Si, ,Nuevo,6,Si,238
,,Robot Aspiradora Neato Wifi Manejalo Con Desde Donde Estes,MLA651632190,24120,98215394,FERRETERIAPACHECO,15,0,Clásica,Si, ,Nuevo,6,Si,203
,,Robot Aspirador Neato Botvac D85,MLA657061847,18900,46119770,HIDRAULICARUBBER,10,0,Clásica,Si, ,Nuevo,6,Si,161
,,Xiaomi Vacuum Aspiradora Inteligente Robot Original Oferta!!,MLA677409742,21999,182933696,TODITONLINE.,1,0,Clásica,Si, ,Nuevo,6,Si,12
,,Combo Roomba 650 + Netatmo Welcome Camara De Seguridad,MLA660068993,18025,161703332,AFTECH.CORP.ARG,1,0,Clásica,Si,iRobot,Nuevo,6,Si,140
,,Robot Aspirador Neato Botvac D75,MLA657061877,16380,46119770,HIDRAULICARUBBER,10,0,Clásica,Si, ,Nuevo,6,Si,161
,,Aspiradora Robot Inteligente Neato Botvac D75 Inalámbrica,MLA654316760,15290,9937333,FERRETERIACENTRALSRL,1,0,Clásica,Si, ,Nuevo,6,Si,183
,,Robot Aspiradora Automática Neato Botvac D75 Envio Gratis,MLA668753116,14199,39144101,BIDCOM,3,0,Clásica,Si, ,Nuevo,6,Si,76
,,Aspirador Inteligente Irobot Roomba 621 Vendedor Oficial,MLA664118361,8399,9316603,COMPUTERS-MARTINEZ,1,0,Clásica,Si, ,Nuevo,6,No,110
,,Aspiradora Robot Inteligente Neato Botvac D75 Inalámbrica,MLA648361446,15745,84051956,CLIMADESIGN,50,0,Clásica,Si, ,Nuevo,6,Si,230
,,Aspiradora Robot Neato  Botvac Connected,MLA654991727,23185,72752255,ASSISTGAS S.R.L.,1,0,Clásica,Si, ,Nuevo,6,Si,177
,,Irobot Roomba 621 + Cepillos Extra + 2 Filtros,MLA670653560,9799,9316603,COMPUTERS-MARTINEZ,1,0,Clásica,Si, ,Nuevo,6,Si,63
,,Robot Limpia Piscina Pileta Dolphin S200 Precio -10% Off,MLA653425331,"29934,19",73830462,WATERCENTER,5,0,Clásica,Si, ,Nuevo,6,Si,189
,,Robot Educativo Kit Arduino 3 En 1 Makeblock Mbot Ranger,MLA671047509,"7199,2",251436639,MAKEBLOCK,10,0,Clásica,Si, ,Nuevo,6,No,60
,,Aspiradora Robot Neato  Botvac  D 75,MLA654990824,15745,72752255,ASSISTGAS S.R.L.,1,0,Clásica,Si, ,Nuevo,6,Si,177
,,Aspiradora Robot Inteligente Usa Neato D75 Mejor Que Roomba,MLA653515824,"16532,25",179035500,HIDROAL,20,0,Clásica,Si, ,Nuevo,6,Si,188
,,Robot Limpia Pisos Neato D85,MLA675098775,17640,179886566,TECNOPLAST1,2,0,Clásica,Si, ,Nuevo,6,Si,29
,,Robot Limpia Piletas Dolphin S50 Envio Gratis A Todo El Pais,MLA633540823,19675,98215394,FERRETERIAPACHECO,100,0,Clásica,Si, ,Nuevo,6,Si,349
,,Barredor Aspiradora Robot Neato D75 Superior Al Roomba,MLA649094351,15000,190455921,SORBELLINISORBELLINI,1,0,Clásica,Si, ,Nuevo,6,Si,223
,,Limpiador De Piscinas Irobot Mirra 530 Fondo Y Pared Irobot,MLA653650614,"34999,99",161703332,AFTECH.CORP.ARG,1,0,Clásica,Si,iRobot,Nuevo,6,Si,187
,,Sdcc 2011 Toynami Futurama Destructor Robot Exclusivo Deluxe,MLA653783643,9900,101017567,BLINKTRASHH,1,0,Clásica,Si, ,Nuevo,6,Si,187
,,Robot Aspiradora Neato Bv Connected,MLA671510618,22100,215006365,PUNTO GARDENIA,1,0,Clásica,Si, ,Nuevo,6,Si,56
,,Robot Para Dibujar Y Grabar Makeblock Xy Plotter,MLA671051419,"11199,2",251436639,MAKEBLOCK,10,0,Clásica,Si, ,Nuevo,6,No,60
,,Robot Limpia Piscina Barrefondo Automático Aquabot I2,MLA661933057,12486,152258468,BOMBASFAL SRL,2,0,Clásica,Si, ,Nuevo,6,Si,127
,,Guardians Of The Galaxy - Marvel Legends - Robot Negro,MLA645042485,5300,188030579,ROBOTNEGRO,1,0,Clásica,Si, ,Nuevo,6,No,258
,,Robot Aspiradora Inteligente Neato D85 Destribuidor Oficial,MLA652247069,18900,98215394,FERRETERIAPACHECO,10,0,Clásica,Si, ,Nuevo,6,No,198
,,Robot Dolphin S200 - Barrefondo Automatico -  Envio Gratis,MLA634455362,29895,48140082,BLADEARGENTINA,999,0,Clásica,Si, ,Nuevo,6,Si,341
,,Acme Scanner Dynamo Mh-635s Robot Scan Luz Dmx Efecto,MLA607147824,"5660,36",10034731,DMX SRL,11,0,Clásica,Si, ,Nuevo,6,No,533
,,Robot Limpia Piscinas Dolphin S100,MLA653531501,24300,46119770,HIDRAULICARUBBER,4,0,Clásica,Si, ,Nuevo,6,Si,188
,,Robot Dolphin S100 Limpia Piscina Fondo Paredes Pileta,MLA639910744,22680,200861406,FERRETERIA_FREIRE,1,0,Clásica,Si, ,Nuevo,6,Si,297
,,Robot Aspiradora Neato Botvac D85 Ideal Casas Con Mascotas!,MLA667905317,18165,176668703,MULTIMAKS,10,0,Clásica,Si, ,Nuevo,6,Si,82
,,Dolphin M4 Pro Sin Caddy,MLA660333400,32590,46119770,HIDRAULICARUBBER,10,0,Clásica,Si, ,Nuevo,6,Si,139
,,Robot Limpia Piscinas Dolphin S200 Piso Pared Y Flotación,MLA636999863,29064,9937333,FERRETERIACENTRALSRL,1,0,Clásica,Si, ,Nuevo,6,Si,321
,,Robot Aspiradora Inteligente D85 Neato - Envio Gratis       ,MLA660349382,18257,243995532,CASAFERNANDES_ML,3,0,Clásica,Si, ,Nuevo,6,No,138
,,Robot De Cocina Todo En Uno Smart-tek Thermo Mixer T1000,MLA677847486,5999,4542417,NECXUS_BAIRES,9999,0,Clásica,Si, ,Nuevo,6,Si,8
,,Aspiradora Robot Neato  Botvac  D 85,MLA654991337,18165,72752255,ASSISTGAS S.R.L.,1,0,Clásica,Si, ,Nuevo,6,Si,177
,,Dolphin S200 Robot Limpiafondos Automatico Con Regalo,MLA675411618,29929,183978307,ILUMINAUDIO.,10,0,Clásica,Si, ,Nuevo,6,Si,26
,,Robot Barre Fondo Aquabot Supreme Silver Automático,MLA647206986,27500,195879302,TORONTO SANITARIOS,2,0,Clásica,Si, ,Nuevo,6,Si,240
,,Robot Aspiradora Para Pisos Neato D75 Representante Oficial,MLA668847830,16380,98215394,FERRETERIAPACHECO,25,0,Clásica,Si, ,Nuevo,6,Si,76
,,Robot Aspiradora Neato Botvac D75 El Mas Potente Del Mercado,MLA667848794,15745,176668703,MULTIMAKS,10,0,Clásica,Si, ,Nuevo,6,Si,83
,,Robot Limpia Barre Fondo Pileta Dolphin,MLA661623867,15000,137585341,ANDRESGODOY517,2,0,Clásica,Si, ,Nuevo,6,Si,128
,,Robot De Cocina Smart-tek T1000 Thermo Mixer Todo En Uno Lcd,MLA678150788,"6699,99",75482619,ANSILA,5,0,Clásica,Si, ,Nuevo,6,Si,6
,,Dolphin S300i Limpiafondo Automatico Robot Bluetooth,MLA628195322,33170,163208206,HIDRAULICARUBBERSMA,120,0,Clásica,Si, ,Nuevo,6,Si,393
,,Robot Dolphin Para Piscinas S50- Barre Fondo,MLA645850990,17480,129918118,HIDRONORTESANITARIOS,1,0,Clásica,Si, ,Nuevo,6,Si,250
,,Dolphin S100 Robot Limpia Piscinas - Oferta!!,MLA639711928,23355,96320494,TECNOG MORENO,1,0,Clásica,Si, ,Nuevo,6,Si,299
,,Robot Espa Aquabot Pool Rover. Zona Sur Banfield,MLA660329426,12550,46119770,HIDRAULICARUBBER,1,0,Clásica,Si, ,Nuevo,6,Si,139
,,Aspiradora Robot Inteligente Irobot Roomba 622 Limpieza Prof,MLA648149427,"9899,99",75482619,ANSILA,5,0,Clásica,Si, ,Nuevo,6,No,231
,,Robot Dolphin Para Piscinas S200- Barre Fondo,MLA647700622,27679,129918118,HIDRONORTESANITARIOS,1,0,Clásica,Si, ,Nuevo,6,Si,235
,,Robot Dolphin S100 Limpia Pileta En Mendoza,MLA637832069,20899,161990496,DTODOAGUA,1,0,Clásica,Si, ,Nuevo,6,Si,314
,,Aspiradora Robot Conga Aspira Y Limpia (mejor Que Roomba!),MLA676808298,9499,9523813,ARCADE CLUB,1,0,Clásica,Si, ,Nuevo,6,Si,16
,,Robot Limpia Piscina Aquabot Breeze Xls Modelo 2017!c/cepill,MLA665886115,12700,126947694,ROSALESJOAQUIN50,1,0,Clásica,Si, ,Nuevo,6,Si,97
,,Robot  De Leds Chaleco Simple Show Alquiler De Trajes,MLA613861108,5500,186270170,ANDYFREAKYBOY,1,0,Clásica,Si, ,Nuevo,6,No,508
,,Robot Limpiapiscinas Dolphin S50 Limpia Piso Ideal Intex,MLA633260033,18910,176668703,MULTIMAKS,6,0,Clásica,Si, ,Nuevo,6,Si,351
,,Robot Limpia Fondo De Piscina Dolphin E10 Más Regalo,MLA624316292,17789,143487279,HIDROPLAT,1,0,Clásica,Si, ,Nuevo,6,Si,427
,,Robot Limpia Piscina Pileta Dolphin S50 Precio -15 Off!!!,MLA653467192,18912,73830462,WATERCENTER,5,0,Clásica,Si, ,Nuevo,6,Si,189
,,Robot Aspiradora Neato D75 El Mas Potente No Roomba - 10%,MLA669393068,15290,73830462,WATERCENTER,1,0,Clásica,Si, ,Nuevo,6,Si,72
,,Robot Irobot Aspiradora Roomba 880 Hasta 80m2 Om,MLA631581710,33690,148742811,FACHA2407,10,0,Clásica,Si, ,Nuevo,6,No,364
,,Robot Aspiradora Conga Slim 890 En Stock!,MLA677711918,9499,43427355,VICTORIA201512,1,0,Clásica,Si, ,Nuevo,6,No,9
,,Robot Limpia Piletas Dolphin S50 En La Plata,MLA640499571,18499,179622249,SELECTOML,1,0,Clásica,Si, ,Nuevo,6,Si,294
,,Rick Grimes - The Walking Dead 1/6 Threezero - Robot Negro,MLA670782955,5200,188030579,ROBOTNEGRO,1,0,Clásica,Si, ,Nuevo,6,No,62
,,Guts - Berserk Figura 1/6 Threezero - Robot Negro,MLA670780696,8500,188030579,ROBOTNEGRO,1,0,Clásica,Si, ,Nuevo,6,No,62
,,Aspiradora Robot Inteligente Neato Botvac Connected Wifi,MLA677812825,23900,253615789,CRISOLCLIMATIZACION,1,0,Clásica,Si, ,Nuevo,6,Si,9
,,Aspiradora Robot Inteligente Neato Botvac D75 Hidrofil,MLA672998125,16363,178546395,HIDROFILML,2,0,Clásica,Si, ,Nuevo,6,Si,44
,,Robot Aspiradora Neato D85,MLA671508061,17300,215006365,PUNTO GARDENIA,2,0,Clásica,Si, ,Nuevo,6,Si,56
,,Robot Aspiradora Neato D85 Lider Aspirando! Precio Eftvo,MLA675769170,18565,183978307,ILUMINAUDIO.,10,0,Clásica,Si, ,Nuevo,6,No,23
,,Robot Dolphin S50 Limpia Piscinas Automatico,MLA652141153,16990,94446587,FERRETERIADELVALLE2006,5,0,Clásica,Si, ,Nuevo,6,Si,198
,,Aspiradora Robot Inteligente Neato Botvac D85 Hidrofil,MLA673001693,18874,178546395,HIDROFILML,1,0,Clásica,Si, ,Nuevo,6,Si,44
,,Robot Educativo Kit Arduino 10 En 1 Makeblock Ultimate 2.0,MLA671056150,"13199,2",251436639,MAKEBLOCK,10,0,Clásica,Si, ,Nuevo,6,No,60
,,Aspiradora Robot Neato D85 Inteligente,MLA677810348,18000,253615789,CRISOLCLIMATIZACION,1,0,Clásica,Si, ,Nuevo,6,Si,9
,,Skull Knight - Berserk Figura 1/6 Threezero - Robot Negro,MLA670782091,9300,188030579,ROBOTNEGRO,1,0,Clásica,Si, ,Nuevo,6,No,62
,,Aspiradora Robot Neato D75 Inteligente,MLA677808804,16000,253615789,CRISOLCLIMATIZACION,1,0,Clásica,Si, ,Nuevo,6,Si,9
,,Robot Dolphin S50 - Barrefondo Automatico -  Envio Gratis,MLA634457331,18975,48140082,BLADEARGENTINA,999,0,Clásica,Si, ,Nuevo,6,Si,341
,,Robot Aspiradora Neato D75,MLA671510094,15000,215006365,PUNTO GARDENIA,1,0,Clásica,Si, ,Nuevo,6,Si,56
,,Dolphin S50 Limpiafondo Piscinas,MLA642477247,"20892,38",217490523,HIDROPOOLOL,1,0,Clásica,Si, ,Nuevo,6,Si,278
,,Robot Educativo Arduino 2 En 1 Makeblock Starter Robot Kit,MLA671046599,"5599,2",251436639,MAKEBLOCK,10,0,Clásica,Si, ,Nuevo,6,No,60
,,Robot Limpia Piscinas Supreme M3 Advanced,MLA639200920,22537,179886566,TECNOPLAST1,1,0,Clásica,Si, ,Nuevo,6,Si,303
,,Robot Aspiradora Neato D85,MLA674906559,17640,139726925,REVESTIMIENTOS ARGENTINOS,1,0,Clásica,Si, ,Nuevo,6,Si,30
,,Robot Aspiradora Neato D85 Limpieza Inteligente En La Plata,MLA658988359,16250,143487279,HIDROPLAT,1,0,Clásica,Si, ,Nuevo,6,No,148
,,Cozmo Robot Increible I.a.!!,MLA671394735,5900,154958389,ASESORIA2014,1,0,Clásica,Si, ,Nuevo,6,No,57
,,Cabezal Robot Movil Cubo Led Rgbw Dmx Audioritmico 360 Grado,MLA649453298,"6499,99",76921648,CYBER-INSUMOS,3,0,Clásica,Si, ,Nuevo,6,No,219
,,Traje Robot De Leds,MLA659164265,30000,90369680,EMANUELLEANDROPRODUCCIONES,1,0,Clásica,Si, ,Nuevo,6,No,147
,,Robot De Led Leds Traje Chaleco Simple,MLA613860994,5500,186270170,ANDYFREAKYBOY,1,0,Clásica,Si, ,Nuevo,6,No,508
,,Dolphin Robot Limpia Fondo De Piscina S50 Nuevo Modelo,MLA634810231,16942,143487279,HIDROPLAT,1,0,Clásica,Si, ,Nuevo,6,Si,338
,,Robot Piscinas Limpiafondo Dolphin S200 Trepa Paredes Nuevo,MLA669907065,28000,236430258,CULZONIPISCINAS,5,0,Clásica,Si, ,Nuevo,6,Si,69
,,Dolphin S200 Limpiafondo Piscinas,MLA642480735,33000,217490523,HIDROPOOLOL,1,0,Clásica,Si, ,Nuevo,6,Si,278
,,Dolphin S50 Robot Limpia Piscinas - Oferta!!,MLA639709734,18910,96320494,TECNOG MORENO,1,0,Clásica,Si, ,Nuevo,6,Si,299
,,Robot Dolphin S200 Barre Fondo Limpia Piscina Nuevo Modelo!,MLA678152731,29900,247342408,FOREST GARDEN,5,0,Clásica,Si, ,Nuevo,6,Si,6
,,Robot Para Pelotero,MLA663846045,5000,136450990,ALEJANDROMARTIN31,1,0,Clásica,Si, ,Nuevo,6,No,112
,,Robot Aquabot Rapid 4wd Limpiafondo Piscina Trepa Pared!,MLA678128805,21790,2939475,LUCAS_FOX31,1,0,Clásica,Si, ,Nuevo,6,Si,6
,,Robots Dolphin S-100 Limpia Piscinas - Pared (ing Maschwitz),MLA641145535,24300,184399251,FERRETERIAELMOLINO,5,0,Clásica,Si, ,Nuevo,6,No,288
,,Robot Limpia Piscinas Dolphin S50,MLA653531504,19675,46119770,HIDRAULICARUBBER,4,0,Clásica,Si, ,Nuevo,6,Si,188
,,Sistema De Alarma Wifi  Gsm Incluye Cámara Robot,MLA659956269,"11499,99",3122241,K:911,3,0,Clásica,Si, ,Nuevo,6,No,141
,,Robot Limpia Piscinas Dolphin S200,MLA653531480,31140,46119770,HIDRAULICARUBBER,4,0,Clásica,Si, ,Nuevo,6,Si,188
,,Droide Robótico Interactivo Star Wars Smart R2-d2 Celular,MLA651461418,7000,44049751,TUBESARG,1,0,Clásica,Si, ,Nuevo,6,No,204
,,Robot Limpia Piscina Dolphin S100 Piletas 10mts Piso Y Pared,MLA670599248,24300,75482619,ANSILA,5,0,Clásica,Si, ,Nuevo,6,Si,63
,,Dolphin Galaxy,MLA660330950,15900,46119770,HIDRAULICARUBBER,1,0,Clásica,Si, ,Nuevo,6,Si,139
,,Robot Dolphin S50 - Envío Gratis! - Limpiafondos Pileta,MLA640973317,18499,191938231,MOBY_ARG,7,0,Clásica,Si, ,Nuevo,6,Si,290
,,Robot Dolphin S200 Limpia Piscina Pileta Envios,MLA651238337,29930,3943112,SANITARIOS RUBIO,2,0,Clásica,Si, ,Nuevo,6,Si,205
,,Robot Dolphin S300i Limpia Pileta En Mendoza,MLA610097547,34239,161990496,DTODOAGUA,1,0,Clásica,Si, ,Nuevo,6,Si,527
,,Trajes Robot Led La Mejor Inversion El Mejor,MLA609983434,18000,4616555,FACEMEGALED VANKLEY,1,0,Clásica,Si, ,Nuevo,6,No,527
,,Robot Limpia Pileta Dolphin S200 Barre Fondo Paredes,MLA659279384,29930,222039575,TOOL SHOP,2,0,Clásica,Si, ,Nuevo,6,Si,146
,,Robot Dolphin S300i Limpia Fondo Pileta C/ Bluetooth Y Carro,MLA638834840,34240,182441201,PINTURERIA PEREZ,3,0,Clásica,Si, ,Nuevo,6,Si,306
,,Nuevo Dolphin S200 Cordoba Capital El Mejor Precio,MLA639965361,29930,231371549,CERROCLORVENTAS,50,0,Clásica,Si, ,Nuevo,6,No,297
,,Dolphin S100 Robot Limpiafondos Automatico Envio Gratis,MLA675410688,23350,183978307,ILUMINAUDIO.,1,0,Clásica,Si, ,Nuevo,6,Si,26
,,Auto Camioneta A Bateria Control Remoto Transf Robot Regalo,MLA660608005,"10999,99",37982924,ALLINTOUCH,999,0,Clásica,Si, ,Nuevo,6,No,136
,,Robot Limpia Piscinas Barrefondo Piso Y Paredes Dolphin S100,MLA637365909,22680,34120743,TODOFERRETERIA,10,0,Clásica,Si, ,Nuevo,6,No,318
,,Robot Dolphin S50 Limpia Fondo Pileta Barrefondo Gtia 1 Año,MLA649459296,"19999,99",182441201,PINTURERIA PEREZ,3,0,Clásica,Si, ,Nuevo,6,Si,219
,,Robot Limpia Piscina Dolphin S50 Piletas 10mts Barre Fondo,MLA672227477,19675,75482619,ANSILA,5,0,Clásica,Si, ,Nuevo,6,Si,51
,,Irobot Roomba 652 Robot Inteligente Aspiradora Limpia Piso,MLA677367119,14999,203804413,NEXT CLICK,1,0,Clásica,Si, ,Nuevo,6,No,12
,,Robot Limpia Piscina Dolphin S200 Piletas 12mts Piso Y Pared,MLA672246280,31140,75482619,ANSILA,5,0,Clásica,Si, ,Nuevo,6,Si,50
,,Robot Limpia Piscinas Dolphin S200 Envio Gratis Todo El Pais,MLA633549415,31140,98215394,FERRETERIAPACHECO,100,0,Clásica,Si, ,Nuevo,6,Si,349
,,Robot Limpia Piletas Dolphin S100 En La Plata,MLA640499691,23355,179622249,SELECTOML,1,0,Clásica,Si, ,Nuevo,6,Si,294
,,Robot Limpiafondo Aquabot Supreme Para Piscina Eeuu,MLA678252634,23150,160259201,RODACOM201,1,0,Clásica,Si, ,Nuevo,6,Si,6
,,Casco Star Wars Para Robot Led,MLA607876178,6000,4616555,FACEMEGALED VANKLEY,1,0,Clásica,Si, ,Nuevo,6,No,538
,,Robot Limpia Piletas Dolphin S200,MLA640173425,29930,179622249,SELECTOML,1,0,Clásica,Si, ,Nuevo,6,Si,295
,,Robot Limpia Piletas Dolphin S200 En La Plata,MLA640499758,29930,179622249,SELECTOML,1,0,Clásica,Si, ,Nuevo,6,Si,294
,,Robot Automático Dolphin S300i ¡envio Gratis! ¡nuevo!,MLA648775137,33167,82903588,MERCEDES821113,1,0,Clásica,Si, ,Nuevo,6,No,225
,,Robot Star Wars R2d2 Banco Electronic Interactivo Nuevo Caja,MLA636373400,5501,8640722,GUYBRUSHT,2,0,Clásica,Si, ,Nuevo,6,Si,326
,,Robot Aspiradora Neato Botvac Connected Lider Precio Eftvo,MLA675770926,23182,183978307,ILUMINAUDIO.,10,0,Clásica,Si, ,Nuevo,6,No,23
,,Robot Dolphin S100 + Regalo!,MLA633011890,24300,194859139,PILETAS CRISCI,10,0,Clásica,Si, ,Nuevo,6,No,352
,,Philips  Msr 1200/2 1200 Lampara Descarga Robot,MLA614272132,6048,10034731,DMX SRL,299,0,Clásica,Si, ,Nuevo,6,No,506
,,Star Wars - Boba Fett 1/6 Sideshow - Robot Negro,MLA651644494,7800,188030579,ROBOTNEGRO,1,0,Clásica,Si, ,Nuevo,6,No,202
,,Robot Aspiradora Neato D75 Lider En Aspiradora Ultra Potente,MLA675767655,15743,183978307,ILUMINAUDIO.,10,0,Clásica,Si, ,Nuevo,6,No,23
,,Griven Mover Robot Con Lampara De Descarga Philips Msd 200,MLA607694141,5000,48326493,TECNOSHOWVELASCO,4,0,Clásica,Si, ,Nuevo,6,No,539
,,Robot Limpia Piletas Dolphin S100,MLA640173080,23355,179622249,SELECTOML,1,0,Clásica,Si, ,Nuevo,6,Si,295
,,Robot Dolphin S100 Limpiafondo Automático Para Piletas,MLA646105657,23350,170800723,AQUACHLOR,1,0,Clásica,Si, ,Nuevo,6,No,248
,,Motor Pivotante Batiente Robot Seg 1/2hp,MLA659834320,10999,235895484,AUTOMATIZACIONES INSUR,10,0,Clásica,Si, ,Nuevo,6,No,142
,,Robot Aspiradora Neato D85 Lider En Aspiradora Ultra Potente,MLA675769042,18165,183978307,ILUMINAUDIO.,10,0,Clásica,Si, ,Nuevo,6,No,23
,,Peloteros Laberintos Modulo Et /terror/ Robot,MLA670110901,33000,61479962,ECOTECNO JUEGOS,1,0,Clásica,Si, ,Nuevo,6,No,67
,,Robot Aspiradora Neato D75 Limpieza Inteligente En La Plata,MLA658985535,14099,143487279,HIDROPLAT,1,0,Clásica,Si, ,Nuevo,6,No,148
,,Acme Scanner Dynamo Mh-635s Robot Scan Luz Dmx Efecto,MLA602045232,"6622,62",10034731,DMX SRL,11,0,Clásica,Si, ,Nuevo,6,No,571
,,Dolphin S50 + Robot Aspiradora Inteligente Neato D75 Cs5632,MLA647513446,34582,7625198,SANITARIOS-ARIETA,999,0,Clásica,Si, ,Nuevo,6,Si,237
,,Robot Limpia Piletas Dolphin S100,MLA659279293,23355,192273152,SELECTOARG,1,0,Clásica,Si, ,Nuevo,6,Si,146
,,Traje De Robot Led Depredador Completo ,MLA676799045,30000,189877052,SNOWMANROBOTLED,1,0,Clásica,Si, ,Nuevo,6,No,16
,,Barrefondo Automatico Zodiac Trepa Paredes Mx8,MLA659833836,14000,206280322,ROSARIOSELLER,1,0,Clásica,Si, ,Nuevo,6,No,142
,,Robot Limpia Piscinas Barrefondo Automatico Dolphin S50,MLA637365720,18362,34120743,TODOFERRETERIA,10,0,Clásica,Si, ,Nuevo,6,No,318
,,Robot Dolphin S300i Con Caddy Robot Piscinas,MLA669839585,33000,236430258,CULZONIPISCINAS,15,0,Clásica,Si, ,Nuevo,6,Si,69
,,Robot Aspiradora Neato Botvac D75 Limpieza Inteligente,MLA662953457,16364,67585694,CLOROOLIVOS,2,0,Clásica,Si, ,Nuevo,6,No,119
,,Controlador Yaskawa 8 Ejes Servo O Paso A Paso Robot Cnc,MLA662940847,9820,11871175,78930,1,0,Clásica,Si, ,Nuevo,6,No,119
,,Sobrino - Robot Educativo Primera Infancia,MLA671811327,6260,166889694,MAQUINASLIBRES,1,0,Clásica,Si, ,Nuevo,6,Si,54
,,¡¡ Sin Stock !! Chogokin Mazinger Z Riobot - Mazinkaiser,MLA671046035,9800,147541309,MYTH JAPAN,1,0,Clásica,Si, ,Nuevo,6,No,60
,,Robot Limpia Piletas Dolphin S100 Vendedor Oficial La Plata,MLA659281116,23355,192273152,SELECTOARG,1,0,Clásica,Si, ,Nuevo,6,Si,146
,,Robot Dolphin S100 Limpia Fondo Nuevo Modelo!!!!,MLA664894439,23350,247342408,FOREST GARDEN,5,0,Clásica,Si, ,Nuevo,6,No,104
,,Nuevo!! Robot Dolphin S 50 Piso Y Ángulos,MLA636320870,18900,67585694,CLOROOLIVOS,4,0,Clásica,Si, ,Nuevo,6,Si,327
,,Robot Limpia Piscinas Dolphin S50 Nuevo Envio Gratis,MLA669906061,18000,236430258,CULZONIPISCINAS,25,0,Clásica,Si, ,Nuevo,6,Si,69
,,Robot Dolphin Limpia Piscinas,MLA665170457,24500,70558366,EDUARDO 0,1,0,Clásica,Si, ,Nuevo,6,Si,102
,,Cabezal Barral Led 4 Robots Con 10w Rgbw Osram,MLA619571427,11500,118276991,DEFABIAN26,4,0,Clásica,Si, ,Nuevo,6,No,465
,,Robot Aspiradora Neato Botvac D85 Limpieza Inteligente,MLA658279854,18873,67585694,CLOROOLIVOS,2,0,Clásica,Si, ,Nuevo,6,No,153
,,Dolphin S200 Robot Limpia Piscinas - Oferta!!,MLA639711608,29930,96320494,TECNOG MORENO,1,0,Clásica,Si, ,Nuevo,6,No,299
,,Toy Story Chogokin Película Robot Sh Figuarts Bandai,MLA675291352,6000,101017567,BLINKTRASHH,2,0,Clásica,Si, ,Nuevo,6,No,27
,,Nuevo!! Robot Dolphin S 200 Paredes Y Línea De Flotación.,MLA636315194,29900,67585694,CLOROOLIVOS,4,0,Clásica,Si, ,Nuevo,6,Si,327
,,Robot Barre Fondo Dolphin S50 Limpia Piscina Piletas,MLA657096512,18499,192273152,SELECTOARG,1,0,Clásica,Si, ,Nuevo,6,Si,161
,,Robot Limpia Piscinas Dolphin S200,MLA664404849,27680,179886566,TECNOPLAST1,5,0,Clásica,Si, ,Nuevo,6,Si,108
,,Traje Robot Led,MLA674121769,22000,28603947,CELL14,1,0,Clásica,Si, ,Nuevo,6,No,36
,,Aspiradora Robot Irobot Roomba 622 Modelo Superior.. Efctvo.,MLA678328042,8300,198945492,SPARTTAKO2016,1,0,Clásica,Si, ,Nuevo,6,Si,5
,,Robot Led De Niños Y De Adultos,MLA626466258,8500,3517457,BATIJAVIER2007,1,0,Clásica,Si, ,Nuevo,6,No,408
,,Robot Dolphin Diagnostic Wonder Con Caddy,MLA671861129,27300,236430258,CULZONIPISCINAS,9,0,Clásica,Si, ,Nuevo,6,Si,54
,,Robot Limpiapiscinas Dolphin M3 ,MLA675816997,21999,139726925,REVESTIMIENTOS ARGENTINOS,1,0,Clásica,Si, ,Nuevo,6,Si,23
,,Robot Aspiradora Inteligente Neato D85,MLA659239879,22869,128836887,MINUSTECHNOLOGY,10,0,Clásica,Si, ,Nuevo,6,No,147
,,Robot Limpiapiscinas Dolphin M4 Supreme Pro ,MLA675817606,34599,139726925,REVESTIMIENTOS ARGENTINOS,1,0,Clásica,Si, ,Nuevo,6,Si,23
,,Juguetes Wonder Pack Dash & Dot 29,MLA657204678,"7068,64",148089117,FUTUROINFORMATICASRL,3,0,Clásica,Si, ,Nuevo,6,No,160
,,Robot Aspiradora Inteligente Neato D75,MLA659240255,19820,128836887,MINUSTECHNOLOGY,10,0,Clásica,Si, ,Nuevo,6,No,147
,,Robot Aspiradora Inteligente Bv Connec. Neato.envio Gratis!!,MLA669302228,23185,194859139,PILETAS CRISCI,1,0,Clásica,Si, ,Nuevo,6,No,72
,,Robot Aspiradora Inteligente | D75 Neato | Puerto Piscina,MLA675784517,16380,244865951,PUERTO PISCINA,1,0,Clásica,Si, ,Nuevo,6,No,23
,,"Nuevo Irobot Roomba 980 Vacío Limpieza Robot, Precios Únicos",MLA635403944,25999,41878430,LUCHIRIDIUM,1,0,Clásica,Si, ,Nuevo,6,No,334
,,Robot Dolphin S300i Nuevo Modelo Limpia Fondo Con Bluetooth,MLA648453655,33170,239337106,PISCINAS BOREAL,1,0,Clásica,Si, ,Nuevo,6,No,229
,,Buzz Toy Story Chogokin Película Robot Sh Figuarts Bandai,MLA677958482,6000,101017567,BLINKTRASHH,2,0,Clásica,Si, ,Nuevo,6,No,8
,,Cecotec Conga Slim 890 - Robot Aspirador Con 5 Modos De Limp,MLA678760330,8999,8634938,FHUNTH,1,0,Clásica,Si, ,Nuevo,6,No,2
,,Robot Aspiradora Inteligente | Bv Connected | Puerto Piscina,MLA675900115,24120,244865951,PUERTO PISCINA,1,0,Clásica,Si, ,Nuevo,6,No,23
,,Kit Automatizacion Porton Bbs Robot Pivotante 1 Hoja 6 Mts,MLA673233015,8800,198956994,RAMISCHGERMAN,999,0,Clásica,Si, ,Nuevo,6,No,43
,,"Lego Boost - Novedad Absoluta, El Robot 5-en-1 De Lego",MLA678795322,12000,208244721,THUMBSUPROPA,2,0,Clásica,Si, ,Nuevo,6,No,2
,,Aspiradora Robot Haier Xshuai Shuaixiaobao ,MLA674293569,8000,95782806,FERNANDO_BOCA77,1,0,Clásica,Si, ,Nuevo,6,No,35
,,Robot Aspiradora Neato D75,MLA674906109,15200,139726925,REVESTIMIENTOS ARGENTINOS,1,0,Clásica,Si, ,Nuevo,6,No,30
,,Dolphin E10 Robot,MLA633264630,17789,181898736,SELVASNATATORIOS,1,0,Clásica,Si, ,Nuevo,6,No,350
,,Robot Aspiradora Inteligente | D85 Neato | Puerto Piscina,MLA675785984,18900,244865951,PUERTO PISCINA,1,0,Clásica,Si, ,Nuevo,6,No,23
,,Robot Aspiradora Inteligente D85 Neato. Envio Gratis!!,MLA669301276,18165,194859139,PILETAS CRISCI,1,0,Clásica,Si, ,Nuevo,6,No,72
,,Mixer Batidora De Mano Robot Coupe Mp 350 Comercial A Pedido,MLA667513212,28000,90952429,PS3ARGENTINA,1,0,Clásica,Si, ,Nuevo,6,No,85
,,Robot Dolphin S300i Limpia Piletas Con Bluetooth Con Caddy,MLA665937793,34240,255273266,BID ARGENTINA,1,0,Clásica,Si, ,Nuevo,6,No,97
,,Enrrollador Automático De Manguera Para Diesel Vulcano,MLA621311829,"15271,47",207858229,FERRE CLICK,1,0,Clásica,Si, ,Nuevo,6,No,451
,,Robot Aspiradora Neato Botvac D85 (6 Cuotas Sin Interés),MLA678699960,21100,67585694,CLOROOLIVOS,2,0,Premium,Si, ,Nuevo,6,No,2
,,Robot Aspiradora Neato Botvac D75 (6 Cuotas Sin Interés),MLA678701638,18200,67585694,CLOROOLIVOS,2,0,Premium,Si, ,Nuevo,6,No,2
,,Robot Dolphin M4 Pro,MLA660335138,32900,97562226,MARIANOLMN,1,0,Clásica,Si, ,Nuevo,6,No,139
,,Robot Interactivo Arturito R2d2 Ar2r2 Ar2t2 De Star-wars,MLA648400177,8501,95678347,GALLEGO CATALANO,3,0,Clásica,Si, ,Nuevo,6,No,229
,,Robot Cozmo .,MLA674847701,7800,6537053,SLONG_PRG,1,0,Clásica,Si, ,Nuevo,6,No,30
,,Kit Motor Pivotante Batiente Robot Porton 5mts Ppa 1hp,MLA673933113,24690,77592540,COLBEN,10,0,Clásica,Si, ,Nuevo,6,No,37
,,Robot Dolphin S50 Limpia Piscina Pileta Barre Fondo,MLA649450970,19674,128836887,MINUSTECHNOLOGY,10,0,Clásica,Si, ,Nuevo,6,No,219
,,Robot Limpiafondo Dolphin  S200,MLA673138567,29930,231371549,CERROCLORVENTAS,50,0,Clásica,Si, ,Nuevo,6,No,44
,,Robot Limpia Piscinas Dolphin E10,MLA656403496,17250,192024156,DACLOR-PISCINAS,1,0,Clásica,Si, ,Nuevo,6,No,166
,,Kit Motor Portón Pivotante Industriual Pivus Robot 1.0,MLA676942447,10999,240678704,ACCESOAUTOMATIZACIONES,1000,0,Clásica,Si, ,Nuevo,6,Si,15
,,Kit Motor Portón Pivotante Industriual Pivus Robot 2.0 Tri,MLA676944091,17999,240678704,ACCESOAUTOMATIZACIONES,1000,0,Clásica,Si, ,Nuevo,6,Si,15
,,Robot Dolphin E20 Piso/pared,MLA678396374,25950,242855904,MAQUINAS.COM,1,0,Clásica,Si, ,Nuevo,6,No,5
,,Robot Starwars R2 D2 Arturito Guerra De Las Galaxias Miralo,MLA673843523,8500,151389331,ELCAPODENEXTEL,2,0,Clásica,Si, ,Nuevo,6,No,38
,,"Robot Led Traje Completo Sin Zancos, Marco Y Pechera Led",MLA675582540,14000,255681154,PLJO1113310,1,0,Clásica,Si, ,Nuevo,6,No,25
